user;from_subreddit;comment;used_subreddits;comment_sentiment
phoenix335;President Donald Trump - Trump 2020! - Election Defense Task Force - Stop The Steal!;"Their defense is ""No mail in voter ever voted for Trump, because Trump told them not to""

As if every one of his voters would follow such advice, always, and in every little precinct of the country.";"[""Men's Rights :: Advocating for the social and legal equality of men and boys since 2008"", ""Men's Rights :: Advocating for the social and legal equality of men and boys since 2008"", ""dankmemes"", ""r/Libertarian: For a Free Society"", ""/r/Memes the original since 2008"", ""r/Libertarian: For a Free Society"", ""President Donald Trump - Trump 2020! - Election Defense Task Force - Stop The Steal!"", ""Jordan Peterson: Descensus ad inferos"", ""Conservative"", ""/r/GrandTheftAutoV"", ""r/Libertarian: For a Free Society"", ""Jordan Peterson: Descensus ad inferos"", ""Announcements"", ""Jordan Peterson: Descensus ad inferos"", ""/r/Memes the original since 2008"", ""Men's Rights :: Advocating for the social and legal equality of men and boys since 2008"", ""Watch Reddit Die"", ""Conservative"", ""Men's Rights :: Advocating for the social and legal equality of men and boys since 2008"", ""Men's Rights :: Advocating for the social and legal equality of men and boys since 2008"", ""Men's Rights :: Advocating for the social and legal equality of men and boys since 2008"", ""DeGoogle - expel Google from your life"", ""Jordan Peterson: Descensus ad inferos"", ""Conservative"", ""r/Libertarian: For a Free Society"", ""Tucker Carlson: The Sworn Enemy of Lying, Pomposity, Smugness & Groupthink"", ""Men's Rights :: Advocating for the social and legal equality of men and boys since 2008"", ""Libertarian Meme"", ""Conservative"", ""r/Libertarian: For a Free Society"", ""President Donald Trump - Trump 2020! - Election Defense Task Force - Stop The Steal!"", ""Conservative"", ""dankmemes"", ""Men's Rights :: Advocating for the social and legal equality of men and boys since 2008"", ""Jordan Peterson: Descensus ad inferos"", ""GTA Online"", ""r/Libertarian: For a Free Society"", ""Conservative"", ""OptiFine - Minecraft performance tuning and advanced graphics"", ""Watch Reddit Die"", ""Men's Rights :: Advocating for the social and legal equality of men and boys since 2008"", ""Shuffles Deck"", ""ArchitecturalRevival"", ""Conservative"", ""Men's Rights :: Advocating for the social and legal equality of men and boys since 2008"", ""Conservative"", ""Tucker Carlson: The Sworn Enemy of Lying, Pomposity, Smugness & Groupthink"", ""Conservative"", ""Conservative"", ""r/Libertarian: For a Free Society""]";
bheyoka;President Donald Trump - Trump 2020! - Election Defense Task Force - Stop The Steal!;I mailed in my trump ballot. I also verified online with my state that it has been counted. I encourage EVERYONE to do the same.;"[""Relationship Advice"", ""Female Dating Strategy "", ""Relationship Advice"", ""President Donald Trump - Trump 2020! - Election Defense Task Force - Stop The Steal!"", ""President Donald Trump - Trump 2020! - Election Defense Task Force - Stop The Steal!"", ""AskThe_Donald"", ""ActualPublicFreakouts"", ""A place for mature women redditors"", ""Female Dating Strategy "", ""When it just hurts to watch"", ""President Donald Trump - Trump 2020! - Election Defense Task Force - Stop The Steal!"", ""AskThe_Donald"", ""LadyBoners: Eye Candy!"", ""Female Dating Strategy "", ""President Donald Trump - Trump 2020! - Election Defense Task Force - Stop The Steal!"", ""President Donald Trump - Trump 2020! - Election Defense Task Force - Stop The Steal!"", ""Female Fashion Advice"", ""DarkAcademia"", ""President Donald Trump - Trump 2020! - Election Defense Task Force - Stop The Steal!"", ""President Donald Trump - Trump 2020! - Election Defense Task Force - Stop The Steal!"", ""Female Dating Strategy "", ""President Donald Trump - Trump 2020! - Election Defense Task Force - Stop The Steal!"", ""PubTips: Your Writing and Publishing Community"", ""For your Opinions that are Unpopular "", ""For your Opinions that are Unpopular "", ""President Donald Trump - Trump 2020! - Election Defense Task Force - Stop The Steal!"", ""LadyBoners: Eye Candy!"", ""LadyBoners: Eye Candy!"", ""Writing"", ""AskThe_Donald"", ""Houseplants"", ""President Donald Trump - Trump 2020! - Election Defense Task Force - Stop The Steal!"", ""Blursed Images"", ""President Donald Trump - Trump 2020! - Election Defense Task Force - Stop The Steal!"", ""Writing"", ""Calorie Counting for Weight Management - Strategies and Encouragement"", ""Married At First Sight"", ""Marriage"", ""President Donald Trump - Trump 2020! - Election Defense Task Force - Stop The Steal!"", ""President Donald Trump - Trump 2020! - Election Defense Task Force - Stop The Steal!"", ""/r/PublicFreakout"", ""Female Dating Strategy "", ""Make Me Suffer"", ""Female Dating Strategy "", ""President Donald Trump - Trump 2020! - Election Defense Task Force - Stop The Steal!"", ""Married At First Sight"", ""Eating Disorders Anonymous: A safe space to discuss our struggles with eating disorders"", ""analytical, conceptual and objective"", ""President Donald Trump - Trump 2020! - Election Defense Task Force - Stop The Steal!"", ""President Donald Trump - Trump 2020! - Election Defense Task Force - Stop The Steal!""]";
911child;President Donald Trump - Trump 2020! - Election Defense Task Force - Stop The Steal!;The fact no left leaning person is questioning this. But if all those votes went to Trump, then they’d care;"[""A subreddit for cute and cuddly pictures"", ""The Elder Scrolls"", ""DNDMemes"", ""/r/Memes the original since 2008"", ""https://imgur.com/cXA7XxW"", ""Power Washing Porn"", ""/r/Memes the original since 2008"", ""/r/Memes the original since 2008"", ""/r/Memes the original since 2008"", ""Not my job"", ""Unexpected"", ""For your Opinions that are Unpopular "", ""Overwatch"", ""Chonkers"", ""/r/Memes the original since 2008"", ""/r/Memes the original since 2008"", ""dankmemes"", ""/r/Memes the original since 2008"", "" Play Stupid Games Win Stupid Prizes"", ""Marvel's Spider-Man"", ""dankmemes"", ""This is my life now"", ""For your Opinions that are Unpopular "", ""Dogs with Jobs"", ""NieR: Automata"", "" Play Stupid Games Win Stupid Prizes"", ""Awful Taste But Great Execution"", ""Marvel's Spider-Man"", ""selfies of the soul"", ""/r/Memes the original since 2008"", ""Sadly, this is not the Onion."", ""/r/Memes the original since 2008"", ""Reddit Pics"", ""/r/Memes the original since 2008"", ""Overwatch"", ""/r/Memes the original since 2008"", ""/r/Memes the original since 2008"", ""dankmemes"", ""Black Magic Fuckery"", ""/r/Memes the original since 2008"", ""/r/Memes the original since 2008"", ""selfies of the soul"", ""Overwatch"", "" Play Stupid Games Win Stupid Prizes"", ""This is my life now"", ""/r/Memes the original since 2008"", ""Reddit Pics"", ""/r/Memes the original since 2008"", ""/r/Memes the original since 2008"", ""Reddit Pics""]";
B0B-NELS0N-USA;President Donald Trump - Trump 2020! - Election Defense Task Force - Stop The Steal!;We can't let this cuck and his cronies steal the election.;"[""funny"", "" Play Stupid Games Win Stupid Prizes"", ""/r/PublicFreakout"", "" Play Stupid Games Win Stupid Prizes"", ""ActualPublicFreakouts"", ""\u2b06 Next Fucking Level \u2b06"", ""Instant Karma"", ""ActualPublicFreakouts"", ""Interesting As Fuck"", ""ActualPublicFreakouts"", ""TrueOffMyChest, a place for people who need to speak their mind"", ""\u2b06 Next Fucking Level \u2b06"", "".gifs - funny, animated gifs for your viewing pleasure"", ""Watch Reddit Die"", ""OldSchoolCool: History's cool kids, looking fantastic "", ""President Donald Trump - Trump 2020! - Election Defense Task Force - Stop The Steal!"", ""Reddit Sports"", ""A subreddit for cute and cuddly pictures"", ""For photos that are, you know, mildly interesting"", ""/r/PublicFreakout"", ""/r/PublicFreakout"", ""President Donald Trump - Trump 2020! - Election Defense Task Force - Stop The Steal!"", ""Today I Learned (TIL)"", ""Nearly Impossible Odds"", ""Look how stupid these kids are"", ""Lifehacks"", ""America's Pastime"", ""Reddit Sports"", ""/r/CHIBears \u2261GSH\u2261"", ""President Donald Trump - Trump 2020! - Election Defense Task Force - Stop The Steal!"", ""Beggars can't be choosers!"", ""Reddit Pics"", ""Home of the Thunder"", ""MLB"", ""Conservative"", ""President Donald Trump - Trump 2020! - Election Defense Task Force - Stop The Steal!"", ""Europe"", ""Scottish People Twitter"", ""Woodworking: all things made from trees. "", ""Look how stupid these kids are"", ""Sydney, Australia"", ""MadeMeSmile"", ""Conservative"", ""President Donald Trump - Trump 2020! - Election Defense Task Force - Stop The Steal!"", ""Chloe"", ""President Donald Trump - Trump 2020! - Election Defense Task Force - Stop The Steal!"", ""Westworld"", ""Startled Cats"", ""CityPorn: Beautiful Cityscapes"", ""ActualPublicFreakouts""]";
bigbubbuzbrew;President Donald Trump - Trump 2020! - Election Defense Task Force - Stop The Steal!;If you don't vote for me, you ain't corrupt.;"[""All news, US and international."", ""World News"", ""All news, US and international."", ""World News"", ""President Donald Trump - Trump 2020! - Election Defense Task Force - Stop The Steal!"", ""All news, US and international."", ""All news, US and international."", ""World News"", ""All news, US and international."", ""Future(s) Studies"", ""All news, US and international."", ""World News"", ""All news, US and international."", ""All news, US and international."", ""All news, US and international."", ""All news, US and international."", ""Conservative"", ""Conservative"", ""President Donald Trump - Trump 2020! - Election Defense Task Force - Stop The Steal!"", ""Conservative"", ""AskThe_Donald"", ""AskTrumpSupporters"", ""All news, US and international."", ""All news, US and international."", ""World News"", ""World News"", ""All news, US and international."", ""President Donald Trump - Trump 2020! - Election Defense Task Force - Stop The Steal!"", ""World News"", ""World News"", ""Conservative"", ""All news, US and international."", ""Conservative"", ""All news, US and international."", ""Conservative"", ""World News"", ""AskThe_Donald"", ""All news, US and international."", ""All news, US and international."", ""AskTrumpSupporters"", ""Conservative"", ""All news, US and international."", ""All news, US and international."", ""Conservative"", ""President Donald Trump - Trump 2020! - Election Defense Task Force - Stop The Steal!"", ""All news, US and international."", ""All news, US and international."", ""Conservative"", ""AskTrumpSupporters"", ""Welcome to /r/Food on Reddit!""]";
KR2814;President Donald Trump - Trump 2020! - Election Defense Task Force - Stop The Steal!;"If he ends up ""winning"" we should call him Faux Biden";"[""Political Compass Memes"", ""Original Trilogy Memes"", ""Political Compass Memes"", ""Political Compass Memes"", ""/r/PewdiepieSubmissions"", ""r/Firearms"", ""Red Dead Redemption 2"", ""/r/PewdiepieSubmissions"", ""Political Compass Memes"", ""dankmemes"", ""PrequelMemes - Memes of the Star Wars Prequels"", ""A sub for Historymemes"", ""America's Pastime"", ""Red Dead Redemption 2"", ""Dank Jewish memes"", ""Political Compass Memes"", ""Political Compass Memes"", ""The back page of the internet "", ""Star Wars Cross-Over Memes"", ""Political Compass Memes"", ""Political Compass Memes"", ""Political Compass Memes"", ""Humor"", ""Sadly, this is not the Onion."", ""The Joe Rogan Experience"", ""Conservative"", ""/r/PewdiepieSubmissions"", ""Conservative"", ""The back page of the internet "", ""A sub for Historymemes"", ""America's Pastime"", ""A sub for Historymemes"", ""A sub for Historymemes"", ""dankmemes"", ""A sub for Historymemes"", ""The back page of the internet "", ""Political Compass Memes"", ""Come on You Spurs!"", ""The back page of the internet "", ""President Donald Trump - Trump 2020! - Election Defense Task Force - Stop The Steal!"", ""PrequelMemes - Memes of the Star Wars Prequels"", ""The Joe Rogan Experience"", ""Political Compass Memes"", ""Political Compass Memes"", ""HolyPrequelMemes"", ""Political Compass Memes"", ""Original Trilogy Memes"", ""Conservative"", ""America's Pastime"", ""PrequelMemes - Memes of the Star Wars Prequels""]";
gartshrimpson;President Donald Trump - Trump 2020! - Election Defense Task Force - Stop The Steal!;i’m so astounded at the intellects of the people who say the 140k in detroit were all for biden because “mail in tends to favor democrats”;"[""JoJo's Bizarre Shitposts"", ""Rainbow Six Siege Memes"", ""JoJo's Bizarre Shitposts"", ""cod zombies okbr map feat 30 perks packapunch all guns call of duty hazbin hotel sex jumpscare"", ""JoJo but cursed"", ""ihaveihaveihavereddit"", ""...where jokes go to die"", ""SocialJusticeInAction"", ""...where jokes go to die"", ""ihaveihaveihavereddit"", ""Reddit Moment"", ""JoJo's Bizarre Shitposts"", ""oddlyterrifying"", ""bruhmoment"", ""President Donald Trump - Trump 2020! - Election Defense Task Force - Stop The Steal!"", ""RedditMadeMeRightWing"", ""Reddit Moment"", ""RedditMadeMeRightWing"", ""Imparting Catholic wisdom through meme"", ""RedditMadeMeRightWing"", ""Simpsons Shitposting"", ""195, Home of Awesome"", ""Fragile Communism"", ""RedditMadeMeRightWing"", ""Tucker Carlson: The Sworn Enemy of Lying, Pomposity, Smugness & Groupthink"", ""Jordan Peterson: Descensus ad inferos"", ""President Donald Trump - Trump 2020! - Election Defense Task Force - Stop The Steal!"", ""Fragile Communism"", ""ihaveihaveihavereddit"", ""Political Compass Memes"", ""RedditMadeMeRightWing"", ""CONSUME - STAY ASLEEP - WORK - CONFORM - REPRODUCE - OBEY - BUY - WATCH TELEVISION"", ""America's Pastime"", ""Videos of perfectly cut scre-"", ""RedditMadeMeRightWing"", ""okbuddyjotard"", ""okbuddyjotard"", ""CONSUME - STAY ASLEEP - WORK - CONFORM - REPRODUCE - OBEY - BUY - WATCH TELEVISION"", ""195, Home of Awesome"", ""President Donald Trump - Trump 2020! - Election Defense Task Force - Stop The Steal!"", ""Brand New Sentence"", ""okbuddyleftist"", ""Reddit Moment"", ""Reddit Moment"", ""JoJo's Bizarre Shitposts"", ""SocialJusticeInAction"", ""195, Home of Awesome"", ""JoJo's Bizarre Shitposts"", ""RedditMadeMeRightWing"", ""Woo-hoo! The Simpsons on Reddit!""]";
RichieAppel;President Donald Trump - Trump 2020! - Election Defense Task Force - Stop The Steal!;Come on, man! Look fat, you’re a damn liar and I don’t work for you. You’re a dog faced pony soldier and you’re too old to vote for me. Will you shut up, man?;"[""WTF?!"", ""Popping Cysts and Pimples"", ""A Song of Ice and Fire"", ""A Song of Ice and Fire"", ""A Song of Ice and Fire"", ""r/gaming"", ""A Song of Ice and Fire"", ""The Elder Scrolls"", ""Westworld"", ""A Song of Ice and Fire"", ""r/TheWalkingDead"", ""A Song of Ice and Fire"", ""The 100 - The CW TV Show"", ""Arrow"", "" Play Stupid Games Win Stupid Prizes"", ""Popping Cysts and Pimples"", ""r/TheWalkingDead"", ""Legends of Tomorrow"", ""A Song of Ice and Fire"", ""The 100 - The CW TV Show"", ""Fallout | Reddit"", ""Fallout | Reddit"", ""The 100 - The CW TV Show"", ""The 100 - The CW TV Show"", ""A Song of Ice and Fire"", ""Fallout | Reddit"", ""Legends of Tomorrow"", ""The Flash"", ""r/TheWalkingDead"", ""The Flash"", ""Beggars can't be choosers!"", ""iZOMBIE"", ""Doctor Who - The Greatest Show in the Galaxy!"", ""Popping Cysts and Pimples"", ""Pants!"", ""Hold My Feeding Tube"", ""The 100 - The CW TV Show"", ""A Song of Ice and Fire"", ""A subreddit about nothing"", ""Fallout | Reddit"", ""Pants!"", ""Scream: The Television Series"", ""iZOMBIE"", ""TalesFromRetail"", ""Scream: The Television Series"", ""A subreddit about nothing"", ""A subreddit about nothing"", ""The Elder Scrolls V: Skyrim"", ""r/gaming"", ""Star Wars Rebels""]";
Bananapants2918;President Donald Trump - Trump 2020! - Election Defense Task Force - Stop The Steal!;"“Because they were all for Biden!”


There were several people I know personally who mail in voted for Trump.  With such logic every in person vote was for Trump, which we know isn’t true. 


The reason in person voting is better is because we don’t have to wait a week to know who the next leader is. They don’t arrive 4 days after election day.";"[""PrequelMemes - Memes of the Star Wars Prequels"", ""Political Compass Memes"", ""A sub for Historymemes"", ""A sub for Historymemes"", ""Political Compass Memes"", ""PrequelMemes - Memes of the Star Wars Prequels"", ""Political Compass Memes"", ""/r/Memes the original since 2008"", ""Political Compass Memes"", ""Political Compass Memes"", ""Noah's Ark"", ""Political Compass Memes"", ""Noah's Ark"", ""Political Compass Memes"", ""Make Me Suffer"", ""Political Compass Memes"", ""/r/Memes the original since 2008"", ""Political Compass Memes"", ""Political Compass Memes"", ""Make Me Suffer"", ""funny"", ""/r/Memes the original since 2008"", ""A sub for Historymemes"", ""PrequelMemes - Memes of the Star Wars Prequels"", ""Forza Motorsport and Horizon"", ""A sub for Historymemes"", ""GTA Online"", ""/r/PewdiepieSubmissions"", ""Cursed Comments"", ""/r/PewdiepieSubmissions"", ""/r/Memes the original since 2008"", ""Le Drumpf is Finished!"", ""Political Compass Memes"", ""ActualPublicFreakouts"", ""Forza Motorsport and Horizon"", ""/r/Memes the original since 2008"", ""Make Me Suffer"", ""/r/Memes the original since 2008"", ""GTA Online"", ""President Donald Trump - Trump 2020! - Election Defense Task Force - Stop The Steal!"", ""PrequelMemes - Memes of the Star Wars Prequels"", ""Political Compass Memes"", ""Political Compass Memes"", ""Political Compass Memes"", ""GTA Online"", ""Political Compass Memes"", ""Starterpacks"", ""A sub for Historymemes"", ""Political Compass Memes"", ""/r/PewdiepieSubmissions""]";
Axel_Foley_;President Donald Trump - Trump 2020! - Election Defense Task Force - Stop The Steal!;Best use of this meme so far;"[""BlackPeopleTwitter"", ""Pro Revenge"", ""When it just hurts to watch"", ""Reddit Pics"", ""OldSchoolCool: History's cool kids, looking fantastic "", ""Advice Animals"", ""ShitPoliticsSays"", ""PC Master Race - A place where all enthusiasts of PC, PC gaming and PC technology are welcome!"", ""SandersForPresident"", ""'MURICA! FUCK YEAH!"", ""Explain Like I'm Five | Don't Panic!"", ""BlackPeopleTwitter"", ""Humans just being bros"", ""BlackPeopleTwitter"", ""Pro Revenge"", ""When it just hurts to watch"", ""Starterpacks"", ""Pro Revenge"", ""Recommend the \""best of\"" streaming content on Netflix"", ""Pro Revenge"", ""Advice Animals"", ""NSFW_GIF"", ""whitepeoplegifs"", ""Reddit Gone Wild - A Decade of Debauchery - 3 million +"", ""ShitPoliticsSays"", ""AnalGW: The Ass GoneWild"", ""Chess: The Game of Kings"", ""Eve Online"", ""Reddit Pics"", ""PC Master Race - A place where all enthusiasts of PC, PC gaming and PC technology are welcome!"", ""TumblrInAction: O Toucan, Where Art Thou?"", ""PC Master Race - A place where all enthusiasts of PC, PC gaming and PC technology are welcome!"", ""Oddly Satisfying"", ""Advice Animals"", ""Reddit Pics"", ""Politics"", ""Pro Revenge"", ""World News"", ""The Most MAGICAL Subreddit on Earth!"", ""Politics"", ""Political Compass Memes"", ""Eve Online"", ""When it just hurts to watch"", ""All news, US and international."", ""A subreddit for cute and cuddly pictures"", ""PC Master Race - A place where all enthusiasts of PC, PC gaming and PC technology are welcome!"", ""Not Safe for Work"", ""Eve Online"", ""Awful Taste But Great Execution"", ""Internet for the Spirit""]";
DD_Hydro_Gunny;President Donald Trump - Trump 2020! - Election Defense Task Force - Stop The Steal!;My question is why mail-in ballots weren’t  counted in the beginning of the election. Why did they wait till the end.  Oh wait we know the answer to that.;"[""Star Citizen"", ""Interesting As Fuck"", ""Star Citizen"", ""Interesting As Fuck"", ""WTF?!"", ""Conservative"", ""Lifehacks"", ""President Donald Trump - Trump 2020! - Election Defense Task Force - Stop The Steal!"", ""Conservative"", ""Eve Online"", ""Well... That sucks..."", ""World of Warships: exploding pixel boats"", ""World of Warships: exploding pixel boats"", ""World of Warships: exploding pixel boats"", ""World of Warships: exploding pixel boats"", ""Conservative"", ""Star Citizen"", ""Conservative"", ""Star Citizen"", ""All things Trashy!"", ""President Donald Trump - Trump 2020! - Election Defense Task Force - Stop The Steal!"", ""President Donald Trump - Trump 2020! - Election Defense Task Force - Stop The Steal!"", ""Star Citizen"", ""Star Citizen"", ""President Donald Trump - Trump 2020! - Election Defense Task Force - Stop The Steal!"", ""World of Warships: exploding pixel boats"", ""President Donald Trump - Trump 2020! - Election Defense Task Force - Stop The Steal!"", ""Conservative"", ""WTF?!"", ""President Donald Trump - Trump 2020! - Election Defense Task Force - Stop The Steal!"", ""Star Citizen"", ""World of Warships: exploding pixel boats"", ""Hold my fries while I..."", ""President Donald Trump - Trump 2020! - Election Defense Task Force - Stop The Steal!"", ""Conservative"", ""President Donald Trump - Trump 2020! - Election Defense Task Force - Stop The Steal!"", ""President Donald Trump - Trump 2020! - Election Defense Task Force - Stop The Steal!"", ""World of Warships: exploding pixel boats"", ""Star Citizen"", ""Conservative"", ""Conservative"", ""President Donald Trump - Trump 2020! - Election Defense Task Force - Stop The Steal!"", ""President Donald Trump - Trump 2020! - Election Defense Task Force - Stop The Steal!"", ""MadeMeSmile"", ""World of Warships: exploding pixel boats"", ""President Donald Trump - Trump 2020! - Election Defense Task Force - Stop The Steal!"", ""Mando Pride"", ""Houston, TX"", ""Star Citizen"", ""President Donald Trump - Trump 2020! - Election Defense Task Force - Stop The Steal!""]";
dayer1;President Donald Trump - Trump 2020! - Election Defense Task Force - Stop The Steal!;Yea DA imagine that..President Trump 2020🇺🇸🇺🇸🇺🇸🇺🇸;"[""A subreddit for cute and cuddly pictures"", ""Unresolved Mysteries"", ""MEOW meOW MEOw"", ""MEOW meOW MEOw"", ""/r/SerialKillers"", ""creepyencounters: post your mildly creepy encounters here!"", ""Unresolved Mysteries"", ""nosleep"", ""creepyencounters: post your mildly creepy encounters here!"", ""Everything Crime"", ""Relationships"", ""Super Short Scary Stories"", ""Curled Feetsies"", ""A subreddit for cute and cuddly pictures"", ""nosleep"", ""Tucker Carlson: The Sworn Enemy of Lying, Pomposity, Smugness & Groupthink"", ""creepyencounters: post your mildly creepy encounters here!"", ""creepyencounters: post your mildly creepy encounters here!"", ""RBI: Reddit Bureau of Investigation"", ""r/TrueCrime"", ""Teeny Tiny Cat Teefs"", ""Let's hope you didn't vote for the pedo"", ""creepyencounters: post your mildly creepy encounters here!"", ""Unresolved Mysteries"", ""Scary Stories"", ""creepyencounters: post your mildly creepy encounters here!"", ""Relationships"", ""MEOW meOW MEOw"", ""Find Maura Murray "", ""Everything Crime"", ""Tucker Carlson: The Sworn Enemy of Lying, Pomposity, Smugness & Groupthink"", ""nosleep"", ""People of Walmart"", ""Ask Reddit..."", ""r/TrueCrime"", ""Purposeful Pusses"", ""Andrew Gosden"", ""Unresolved Mysteries"", ""People of Walmart"", ""Everything Crime"", ""self.reddit"", ""nosleep"", ""nosleep"", ""Ask Reddit..."", ""Unresolved Mysteries"", ""Andrew Gosden"", ""East Area Rapist / Original Night Stalker / Golden State Killer"", ""nosleep"", ""A subreddit for cute and cuddly pictures"", ""/r/SerialKillers""]";
