user;from_subreddit;comment;used_subreddits;comment_sentiment
silldog;President-elect Joe Biden;"Logic is a Marxist conspiracy!

But seriously, I voted Biden but I know some republicans and most of them aren’t this far down the rabbit hole. They’ll move on to the next guy who wants to cut taxes or mention the Bible. The diehard Trumpers on the other hand who ride around in these caravans are regularly exposed to 1984 level propaganda and will believe any conspiracy theory. These people are weaponized stupidity.";"[""Television News and Discussion"", ""/r/PublicFreakout"", ""President-elect Joe Biden"", ""/r/PublicFreakout"", ""/r/PublicFreakout"", ""/r/PublicFreakout"", ""/r/PublicFreakout"", ""Politics"", ""President-elect Joe Biden"", ""/r/PublicFreakout"", ""/r/PublicFreakout"", ""/r/PublicFreakout"", ""2020 Political Hindsight - a Donald Trump lovefest"", ""Politics"", ""World News"", ""/r/PublicFreakout"", ""/r/PublicFreakout"", ""Politics"", ""/r/PublicFreakout"", ""Politics"", ""2020 Political Hindsight - a Donald Trump lovefest"", ""/r/PublicFreakout"", ""President-elect Joe Biden"", ""President-elect Joe Biden"", ""Politics"", ""Insane People on Facebook"", ""I never thought leopards would eat MY face"", ""2020 Political Hindsight - a Donald Trump lovefest"", ""Politics"", ""2020 Political Hindsight - a Donald Trump lovefest"", ""Insane People on Facebook"", ""Insane People on Facebook"", ""White People Twitter"", ""The Right Can't Meme"", ""The Right Can't Meme"", ""The Right Can't Meme"", ""The Right Can't Meme"", ""The Right Can't Meme"", ""The Right Can't Meme"", ""The Right Can't Meme"", ""Conservative"", ""Conservative"", ""Conservative"", ""Conservative"", ""/r/PublicFreakout"", ""/r/PublicFreakout"", ""/r/PublicFreakout"", ""President-elect Joe Biden"", ""/r/PublicFreakout"", ""Ask Reddit...""]";
SideHug;President-elect Joe Biden;Imagine thinking corruption can only go one way;"[""Advice Animals"", ""Rainbow 6"", ""Today I Fucked Up"", ""The Hivemind Improving Homes"", ""Safety First!"", ""What Could Possibly Go Wrong?"", ""A gallery of inexplicable stupidity"", ""PC Gaming"", ""Safety First!"", ""r/ProtectandServe"", ""The Hivemind Improving Homes"", ""For All Things Creepy"", ""BlackPeopleTwitter"", ""/r/buildapc - Planning on building a computer but need some advice? This is the place to ask!"", ""Counter-Strike: Global Offensive"", ""/r/Technology "", ""Today I Fucked Up"", ""/r/buildapc - Planning on building a computer but need some advice? This is the place to ask!"", ""the thicker the skin, the better the roast"", ""OnStageGW"", ""Novel Coronavirus (COVID-19)"", ""/r/h3h3productions - official subreddit of h3h3productions - h3h3"", ""Safety First!"", ""Electricians of Reddit"", ""WTF?!"", ""r/gaming"", ""All news, US and international."", ""Just Rolled Into the Shop"", ""Electricians of Reddit"", ""DayZ: Zombie Madness!"", ""/r/buildapc - Planning on building a computer but need some advice? This is the place to ask!"", ""Safety First!"", ""DayZ: Zombie Madness!"", ""BlackPeopleTwitter"", ""DayZ: Zombie Madness!"", ""BlackPeopleTwitter"", ""/r/PublicFreakout"", ""Escape From Tarkov"", ""Specialized Tools"", ""Electricians of Reddit"", ""The Hivemind Improving Homes"", ""PC Gaming"", ""DayZ: Zombie Madness!"", ""Those NSFW photos posted on social media"", ""beer ideas"", ""Rick and Morty News and Discussion"", ""Advice Animals"", ""DayZ: Zombie Madness!"", ""Fishing "", ""DayZ: Zombie Madness!""]";
sunhickory;President-elect Joe Biden;They know no election fraud happened, it just doesn't fit their narrative in the case of Biden being elected as the president and replacing their beloved trump.;"[""President-elect Joe Biden"", ""President-elect Joe Biden"", ""President-elect Joe Biden"", ""President-elect Joe Biden"", ""President-elect Joe Biden"", ""President-elect Joe Biden"", ""President-elect Joe Biden"", ""President-elect Joe Biden"", ""President-elect Joe Biden"", ""President-elect Joe Biden"", ""President-elect Joe Biden"", ""Democrats: Unite for a Better Future"", ""President-elect Joe Biden"", ""Democrats: Unite for a Better Future"", ""President-elect Joe Biden"", ""President-elect Joe Biden"", ""Politics"", ""Politics"", ""Trumpvirus"", ""President-elect Joe Biden"", ""Wicca: Reconnecting with the Gods"", ""Wicca: Reconnecting with the Gods"", ""President-elect Joe Biden""]";
iTroLowElo;President-elect Joe Biden;Because Republicans are allergic to the truth. And also science apparently.;"[""Politics"", ""NBA"", ""Politics"", ""White People Twitter"", ""White People Twitter"", ""Today I Learned (TIL)"", ""Politics"", ""Impeach_Trump"", ""funny"", ""All news, US and international."", ""Politics"", ""Movie News and Discussion"", ""wallstreetbets"", ""All news, US and international."", ""Politics"", ""r/Cars - For Car Enthusiasts"", ""NBA"", ""Politics"", ""NBA"", ""wallstreetbets"", ""/r/Technology "", ""Novel Coronavirus (COVID-19)"", ""Politics"", ""confidentlyincorrect"", ""Politics"", ""Today I Learned (TIL)"", ""White People Twitter"", ""Today I Learned (TIL)"", ""Politics"", ""The Dismal Science"", ""wallstreetbets"", ""All news, US and international."", ""Novel Coronavirus (COVID-19)"", ""All news, US and international."", ""Seattle's Reddit Community"", ""wallstreetbets"", ""Novel Coronavirus (COVID-19)"", ""NBA"", ""NBA"", ""World News"", ""I never thought leopards would eat MY face"", ""Where Justice is Made"", ""NBA"", ""atheism"", ""Today I Learned (TIL)"", ""Starcraft on Reddit"", ""r/Apple - the unofficial Apple community"", ""All news, US and international."", ""Advice Animals"", ""Novel Coronavirus (COVID-19)""]";
WindLane;President-elect Joe Biden;"This is asking for the rational Republicans to explain the actions of the irrational Republicans.

They aren't going to have an easier time figuring it out than we are.

The problem is that Trump emboldened the absolute worst people. Those people have gotten loud and belligerent with practically everything they do and they seem to feel that Trump was the best thing ever because he made it okay for them to be their horrible selves wherever they feel like.

Trump losing the election, takes all that away. So those obnoxious, ignorant pricks are going to be as loud and as obnoxious as they can on their way out in the hopes that throwing a temper tantrum will change the results.

At their core, they are ignorant. The House and the Senate didn't change all that much and none of those folks are backing idiots like the Proud Boys openly like Trump is. They've got no reason to *care* about the House and the Senate - so they don't care about those votes and just give their ignorant, ""yeah, that vote was fair.""

Republicans probably couldn't tell you this because they're too close to the problem, don't want to make their party look even worse, or are too ashamed of their fellow party members to speak out against them - with a heavy dose of not wanting to be tarred with the same brush.";"[""All news, US and international."", ""NBA"", ""NBA"", ""NBA"", ""White People Twitter"", ""Ask Reddit..."", ""NBA"", ""NBA"", ""NBA"", ""NBA"", ""Ask Reddit..."", ""All news, US and international."", ""NBA"", ""NBA"", ""NBA"", ""PhotoshopBattles"", ""All things Trashy!"", ""Future(s) Studies"", ""NBA"", ""NBA"", ""NBA"", ""NBA"", ""NBA"", ""The Best and Worst of TikTok"", ""NBA"", ""NBA"", ""NBA"", ""NBA"", ""Today I Learned (TIL)"", ""NBA"", ""Prompts and motivation to create something out of nothing"", ""NBA"", ""NBA"", ""NBA"", ""NBA"", ""NBA"", ""NBA"", ""NBA"", ""NBA"", ""MovieDetails"", ""World News"", ""NBA"", ""Accidental Racism: When innocent things appear to be racism, though it's totally not intentional "", ""NBA"", ""NBA"", ""NBA"", ""NBA"", ""NBA"", ""NBA"", ""NBA""]";
GazimoEnthra;President-elect Joe Biden;"i live in a very conservative area and they really just don't understand how government works. 

&#x200B;

an example just from today- group of angry people standing around, without masks, upset biden won. talking about how scientists are useless because the pandemic keeps getting worse and ""they haven't fixed it yet"". they're completely clueless.";"[""RuPaul's Drag Race"", ""RuPaul's Drag Race"", ""RuPaul's Drag Race"", ""/r/medicine: a subreddit for medical professionals"", ""RuPaul's Drag Race"", ""RuPaul's Drag Race"", ""RuPaul's Drag Race"", ""RuPaul's Drag Race"", ""RuPaul's Drag Race"", ""/r/MedicalSchool"", ""World News"", ""RuPaul's Drag Race"", ""RuPaul's Drag Race"", ""RuPaul's Drag Race"", ""RuPaul's Drag Race"", ""/r/MedicalSchool"", ""RuPaul's Drag Race"", ""/r/medicine: a subreddit for medical professionals"", ""RuPaul's Drag Race"", ""Clash Royale: A Most Ridiculous Duel!"", ""/r/MedicalSchool"", ""RuPaul's Drag Race"", ""RuPaul's Drag Race"", ""/r/MedicalSchool"", ""RuPaul's Drag Race"", ""/r/MedicalSchool"", ""RuPaul's Drag Race"", ""/r/MedicalSchool"", ""/r/MedicalSchool"", ""RuPaul's Drag Race"", ""/r/MedicalSchool"", ""Popcorn tastes good."", ""RuPaul's Drag Race"", ""/r/MedicalSchool"", ""World News"", ""RuPaul's Drag Race"", ""/r/MedicalSchool"", ""RuPaul's Drag Race"", ""RuPaul's Drag Race"", ""RuPaul's Drag Race"", ""Overwatch"", ""/r/MedicalSchool"", ""RuPaul's Drag Race"", ""/r/medicine: a subreddit for medical professionals"", ""/r/MedicalSchool"", ""RuPaul's Drag Race"", ""/r/MedicalSchool"", ""BlackPeopleTwitter"", ""/r/MedicalSchool"", ""RuPaul's Drag Race""]";
Fynn_the_Finger;President-elect Joe Biden;"This is not against you in particular, because what you're doing is classy so I'm going to assume you're a stand up guy/gal.  But I would like to point out that Democrats are always called upon ""to heal the division"" every time in they're in power.  While Republicans spike the ball and talk about sticking it to liberals.  Clinton appointed a Republican to be defense secretary.  I'll give Bush some credit, he appointed a democrat to be secretary of transportation (this is more than offset by the purge at the justice department, and it's a less important post than defense but okay, at least there was reciprocity).  Obama appointed three.  It was not only a reciprocal gesture, but an expansion of it.  It was a very ambitious good faith gesture that cost him with his own party.  But it was not met in kind by Republicans in Congress, and Trump of course did nothing to keep such attempts at bipartisanship.

I beg you, when you cast your next primary vote for house, senate and the presidency, you vote for someone who will work *with* Democrats.  I spent the first twenty years of my political life as an independent, I'm now a Democrat.  And that's because I see one party trying to work with the other, and the other doesn't even try.  Please help change that.";"[""Reddit Pics"", ""World News"", ""Politics"", ""Politics"", ""World News"", ""Politics"", ""World News"", ""Advice Animals"", ""Politics"", ""Politics"", ""All news, US and international."", ""World News"", ""r/gaming"", ""Politics"", ""Politics"", ""World News"", ""Politics"", ""Politics"", ""/r/Technology "", ""Politics"", ""Ask Reddit..."", ""Politics"", ""funny"", ""Politics"", ""All news, US and international."", ""Advice Animals"", ""r/gaming"", ""Ask Reddit..."", ""Today I Learned (TIL)"", ""World News"", ""Politics"", ""funny"", ""Ask Reddit..."", ""Showerthoughts"", ""Movie News and Discussion"", ""Politics"", ""Ask Reddit..."", ""Politics"", ""Ask Reddit..."", ""MarchAgainstTrump"", ""Politics"", ""Advice Animals"", ""Politics"", ""Politics"", ""Quality Gaming Content and Discussion -- /r/Games"", ""President-elect Joe Biden"", ""Politics"", ""Politics"", ""Politics"", ""Politics""]";
xevba;President-elect Joe Biden;"If your candidate would had won, do you think he would've given a speech like that? 

And that's all you need to know why 75 million didn't vote for the current gas lighting mother fucker.

You know what's interesting? The rest of the world is celebrating... I am getting calls overseas....friends and family congratulating us. 

That didn't happen when Trump won. The rest of the world aren't all liberal, they are a hell of a lot more objective than that.

All our European allies are at ease. That should tell you something. 

Get off Facebook bro, it's bad for your brain. The Republican party is a joke.";"[""/r/Technology "", ""President-elect Joe Biden"", ""/r/Warframe"", ""PC Gaming"", ""Borderlands"", ""Enough \u0422\u0440\u0430\u043c\u043f Spam!"", ""Regretting Joe Biden"", ""/r/Warframe"", ""Enough \u0422\u0440\u0430\u043c\u043f Spam!"", ""PC Gaming"", ""Destiny | Reddit"", ""Destiny | Reddit"", ""Politics"", ""Regretting Joe Biden"", ""Politics"", ""Borderlands"", ""/r/GrandTheftAutoV"", ""Politics"", ""Game of Thrones"", ""Politics"", ""Dragon World"", ""Regretting Joe Biden"", ""Enough \u0422\u0440\u0430\u043c\u043f Spam!"", ""All news, US and international."", ""Enough \u0422\u0440\u0430\u043c\u043f Spam!"", ""Enough \u0422\u0440\u0430\u043c\u043f Spam!"", ""Tom Clancy's The Division 2"", ""Politics"", ""Dragon World"", ""President-elect Joe Biden"", ""r/AnthemTheGame"", ""PC Gaming"", ""/r/Warframe"", ""Quality Gaming Content and Discussion -- /r/Games"", ""Politics"", ""Star Wars - A long time ago, in a galaxy far, far, away..."", ""Rainbow 6"", ""Politics"", ""Enough \u0422\u0440\u0430\u043c\u043f Spam!"", ""Destiny | Reddit"", ""Tom Clancy's The Division 2"", ""All news, US and international."", ""Tom Clancy's The Division 2"", ""Quality Gaming Content and Discussion -- /r/Games"", ""/r/Borderlands3 - The Borderlands 3 Reddit"", ""Destiny | Reddit"", ""Quality Gaming Content and Discussion -- /r/Games"", ""/r/Borderlands3 - The Borderlands 3 Reddit"", ""Destiny | Reddit"", ""/r/GrandTheftAutoV""]";
HatchSmelter;President-elect Joe Biden;"Two days ago, you said this:

>If we lose, we lose democracy.  Every future election will be as corrupt as this one. 

What has changed since then?";"[""Politics"", ""Politics"", ""Politics"", ""Politics"", ""Politics"", ""Politics"", ""Politics"", ""Politics"", ""Politics"", ""All news, US and international."", ""Politics"", ""Once in a blue moon..."", ""Politics"", ""Politics"", ""Politics"", ""All news, US and international."", ""President-elect Joe Biden"", ""Novel Coronavirus (COVID-19)"", ""All news, US and international."", ""All news, US and international."", ""Politics"", ""Politics"", ""Politics"", ""Politics"", ""All news, US and international."", ""Politics"", ""Life Pro Tips"", ""The Ideological Trashcan"", ""President-elect Joe Biden"", ""Politics"", ""Politics"", ""Novel Coronavirus (COVID-19)"", ""Politics"", ""All news, US and international."", ""Politics"", ""Politics"", ""Once in a blue moon..."", ""Politics"", ""All news, US and international."", ""Politics"", ""Politics"", ""2020 Political Hindsight - a Donald Trump lovefest"", ""All news, US and international."", ""The Ideological Trashcan"", ""Politics"", ""Politics"", ""All news, US and international."", ""Once in a blue moon..."", ""All news, US and international."", ""Novel Coronavirus (COVID-19)""]";
harpsm;President-elect Joe Biden;Biden was among my last choices in the primaries, but he won me over during the campaign.  If anyone can start to heal the divisiveness, it's him.;"[""the thicker the skin, the better the roast"", ""the thicker the skin, the better the roast"", ""the thicker the skin, the better the roast"", ""the thicker the skin, the better the roast"", ""the thicker the skin, the better the roast"", ""the thicker the skin, the better the roast"", ""the thicker the skin, the better the roast"", ""Politics"", ""Politics"", ""the thicker the skin, the better the roast"", ""Politics"", ""the thicker the skin, the better the roast"", ""Politics"", ""the thicker the skin, the better the roast"", ""Politics"", ""Politics"", ""the thicker the skin, the better the roast"", ""2020 Political Hindsight - a Donald Trump lovefest"", ""Politics"", ""the thicker the skin, the better the roast"", ""the thicker the skin, the better the roast"", ""Politics"", ""the thicker the skin, the better the roast"", ""Politics"", ""Politics"", ""Politics"", ""Politics"", ""the thicker the skin, the better the roast"", ""Politics"", ""Politics"", ""Politics"", ""the thicker the skin, the better the roast"", ""Politics"", ""the thicker the skin, the better the roast"", ""35,000+ Tweets, No Self Awareness"", ""Behold, the Master Race"", ""Politics"", ""Politics"", ""Politics"", ""2020 Political Hindsight - a Donald Trump lovefest"", ""the thicker the skin, the better the roast"", ""Politics"", ""2020 Political Hindsight - a Donald Trump lovefest"", ""Politics"", ""Politics"", ""Politics"", ""Politics"", ""Politics"", ""Politics"", ""the thicker the skin, the better the roast""]";
OrangeUTraitor;President-elect Joe Biden;"Republicans are the dividers always embracing radicalism, which is how they lost this election, Biden doesn't change that at all.

Stop being radicals AND THEN ask for unity. You need to go ask other Republicans to act like normal human beings capable of compromise, not preach it to the party of compromise.

Take your efforts and put them where they should have always been, in your own party. The fake calls for unity don't help and Dems calling for unity won't help. 

**YOU have to call out YOUR OWN people to make anything happen**. We already compromised too much with your radicalism and now we even need to FBI to counter **your domestic terror threats** on a regular basis.";"[""Politics"", ""Politics"", ""Politics"", ""Novel Coronavirus (COVID-19)"", ""President-elect Joe Biden"", ""CoronavirusRecession"", ""Politics"", ""Politics"", ""Politics"", ""President-elect Joe Biden"", ""President-elect Joe Biden"", ""Novel Coronavirus (COVID-19)"", ""environment"", ""Politics"", ""environment"", ""President-elect Joe Biden"", ""President-elect Joe Biden"", ""Novel Coronavirus (COVID-19)"", ""CoronavirusRecession"", ""Politics"", ""President-elect Joe Biden"", ""environment"", ""President-elect Joe Biden"", ""CoronavirusRecession"", ""President-elect Joe Biden"", ""Politics"", ""CoronavirusRecession"", ""Politics"", ""Novel Coronavirus (COVID-19)"", ""Novel Coronavirus (COVID-19)"", ""Novel Coronavirus (COVID-19)"", ""President-elect Joe Biden"", ""Novel Coronavirus (COVID-19)"", ""Politics"", ""A place for a rational discussion on a divisive topic."", ""Politics"", ""Politics"", ""President-elect Joe Biden"", ""Novel Coronavirus (COVID-19)"", ""Politics"", ""Democrats: Unite for a Better Future"", ""President-elect Joe Biden"", ""Novel Coronavirus (COVID-19)"", ""CoronavirusRecession"", ""Politics"", ""Politics"", ""environment"", ""Politics"", ""Politics"", ""CoronavirusRecession""]";
PluotFinnegan_IV;President-elect Joe Biden;"""I voted for chaos but they lost... Pretty please let's not have what goes around comes around?""

You voted for Trump because he protects Catholics? Biden is an engaged practicing Catholic, Trump can't give you a single verse from the Bible. Trump protected his own interests because he wants his SC to give him an illegitimate win.";"[""Politics"", ""Politics"", ""Politics"", ""Politics"", ""President-elect Joe Biden"", ""Political Discussion"", ""Politics"", ""President-elect Joe Biden"", ""Politics"", ""Politics"", ""Politics"", ""Politics"", ""Politics"", ""Politics"", ""Politics"", ""Politics"", ""President-elect Joe Biden"", ""FiveThirtyEight"", ""President-elect Joe Biden"", ""President-elect Joe Biden"", ""President-elect Joe Biden"", ""President-elect Joe Biden"", ""NFL: National Football League Discussion"", ""Politics"", ""Politics"", ""Politics"", ""FiveThirtyEight"", ""WoW Economy - Gold Makers Unite!"", ""WoW Economy - Gold Makers Unite!"", ""Politics"", ""President-elect Joe Biden"", ""FiveThirtyEight"", ""World of Warcraft"", ""President-elect Joe Biden"", ""Politics"", ""Politics"", ""Democrats: Unite for a Better Future"", ""Politics"", ""World of Warcraft"", ""Politics"", ""FiveThirtyEight"", ""Politics"", ""WoW Economy - Gold Makers Unite!"", ""Politics"", ""Politics"", ""Politics"", ""Politics"", ""Politics"", ""President-elect Joe Biden"", ""Democrats: Unite for a Better Future""]";
CovertWolf86;President-elect Joe Biden;You are not forgiven because you have not admitted wrongdoing.;"[""World News"", ""All news, US and international."", ""All news, US and international."", ""Gif Recipes"", ""Future(s) Studies"", ""All news, US and international."", ""World News"", ""World News"", ""All news, US and international."", ""All news, US and international."", ""Today I Learned (TIL)"", ""World News"", ""All news, US and international."", ""All news, US and international."", ""Murdered By Words"", ""The Dismal Science"", ""Politics"", ""Gif Recipes"", ""r/Libertarian: For a Free Society"", ""All news, US and international."", ""What's everyone on about?"", ""All news, US and international."", ""2020 Political Hindsight - a Donald Trump lovefest"", ""All news, US and international."", ""All news, US and international."", ""All news, US and international."", ""r/LivestreamFail: Livestream wins, fails, and everything in between"", ""Destiny | Reddit"", ""All news, US and international."", ""World News"", ""All news, US and international."", ""Monster Hunter: World"", ""Cool Guides"", ""All news, US and international."", ""All news, US and international."", ""World News"", ""All news, US and international."", ""All news, US and international."", ""All news, US and international."", ""World News"", ""World News"", ""World News"", ""All news, US and international."", ""World News"", ""All news, US and international."", ""Today I Learned (TIL)"", ""All news, US and international."", ""World News"", ""World News"", ""World News""]";
Part-time_Hipster;President-elect Joe Biden;Honestly, I'm not there yet. The amount of vitriol spewed at me by Trump supporters has made me question if I can really ever respect someone who supported Trump. Seriously, my own brother threatened me with physical harm because I didn't support Trump. His supporters spent the last four years jeering, while celebrating wanton acts of cruelty all because that was the party line.;"[""Politics"", ""Politics"", ""Politics"", ""Politics"", ""Politics"", ""Politics"", ""All news, US and international."", ""Politics"", ""Politics"", ""Politics"", ""Politics"", ""Law: Covering current developments in law"", ""Politics"", ""Politics"", ""President-elect Joe Biden"", ""Tumblr"", ""Politics"", ""World News"", ""Politics"", ""Catastrophic Failure"", ""Reddit Pics"", ""President-elect Joe Biden"", ""Politics"", ""Law: Covering current developments in law"", ""/r/PublicFreakout"", ""Politics"", ""The back page of the internet "", ""Politics"", ""Political Discussion"", ""All news, US and international."", ""Catastrophic Failure"", ""Politics"", ""Ask Reddit..."", ""White People Twitter"", ""Politics"", ""The back page of the internet "", ""Politics"", ""Politics"", ""Political Discussion"", ""Politics"", ""Ask Reddit..."", ""Politics"", ""Politics"", ""Politics"", ""Politics"", ""Political Discussion"", ""Politics"", ""Ask Reddit..."", ""/r/Memes the original since 2008"", ""Ask Reddit...""]";
tegeusCromis;President-elect Joe Biden;I’m not an American, but I have a burning question: given your very sensible stand now, how were you able to support Trump just a few days ago? And if you were to go back to that time, having had the thoughts/experiences you have now, would you still be pulling for him to win (assuming the outcome could somehow be different)? I’m trying to understand how these two sets of views can be compatible.;"[""MMA: Mixed Martial Arts"", ""Beggars can't be choosers!"", ""MMA: Mixed Martial Arts"", ""Novel Coronavirus (COVID-19)"", ""MMA: Mixed Martial Arts"", ""MMA: Mixed Martial Arts"", ""MMA: Mixed Martial Arts"", ""MMA: Mixed Martial Arts"", ""Legal Advice ~ A place to get simple legal advice* "", ""MMA: Mixed Martial Arts"", ""Legal Advice ~ A place to get simple legal advice* "", ""MMA: Mixed Martial Arts"", ""MMA: Mixed Martial Arts"", ""MMA: Mixed Martial Arts"", ""MMA: Mixed Martial Arts"", ""ADIOS!"", ""MMA: Mixed Martial Arts"", ""MMA: Mixed Martial Arts"", ""MMA: Mixed Martial Arts"", ""MMA: Mixed Martial Arts"", ""World News"", ""MMA: Mixed Martial Arts"", ""MMA: Mixed Martial Arts"", ""MMA: Mixed Martial Arts"", ""MMA: Mixed Martial Arts"", ""MMA: Mixed Martial Arts"", ""MMA: Mixed Martial Arts"", ""MMA: Mixed Martial Arts"", ""MMA: Mixed Martial Arts"", ""MMA: Mixed Martial Arts"", ""Legal Advice ~ A place to get simple legal advice* "", ""Legal Advice ~ A place to get simple legal advice* "", ""MMA: Mixed Martial Arts"", ""Best of Legal Advice (BOLA) ~ Meta discussion of r/legaladvice"", ""MMA: Mixed Martial Arts"", ""MMA: Mixed Martial Arts"", ""MMA: Mixed Martial Arts"", ""Insane People on Facebook"", ""Best of Legal Advice (BOLA) ~ Meta discussion of r/legaladvice"", ""Where jokes go to be revived."", ""MMA: Mixed Martial Arts"", ""MMA: Mixed Martial Arts"", ""MMA: Mixed Martial Arts"", ""MMA: Mixed Martial Arts"", ""Legal Advice ~ A place to get simple legal advice* "", ""MMA: Mixed Martial Arts"", ""MMA: Mixed Martial Arts"", ""MMA: Mixed Martial Arts"", ""MMA: Mixed Martial Arts"", ""MMA: Mixed Martial Arts""]";
