user;from_subreddit;comment;used_subreddits;comment_sentiment
TaterBaker89;President Donald Trump - Trump 2020! - Election Defense Task Force - Stop The Steal!;I called it before opening... just from the title! Awesome!;"[""Novel Coronavirus (COVID-19)"", ""Conservative"", ""Conservative"", ""Movie News and Discussion"", ""Murdered By Words"", ""Conservative"", ""Conservative"", ""President Donald Trump - Trump 2020! - Election Defense Task Force - Stop The Steal!"", ""Conservative"", ""Georgia Camp and Hike"", ""DRAIN the SWAMP"", ""A subreddit for cute and cuddly pictures"", ""Conservative"", ""Conservative"", ""Conservative"", ""Conservative"", ""Conservative"", ""President Donald Trump - Trump 2020! - Election Defense Task Force - Stop The Steal!"", ""President Donald Trump - Trump 2020! - Election Defense Task Force - Stop The Steal!"", ""Conservative"", ""A subreddit for cute and cuddly pictures"", ""Conservative"", ""DRAIN the SWAMP"", ""Conservative"", ""Conservative"", ""Admit your wrongdoings. "", ""President Donald Trump - Trump 2020! - Election Defense Task Force - Stop The Steal!"", ""President Donald Trump - Trump 2020! - Election Defense Task Force - Stop The Steal!"", ""Conservative"", ""Conservative"", ""Murdered By Words"", ""Conservative"", ""Conservative"", ""[REDACTED]"", ""DRAIN the SWAMP"", ""Georgia Camp and Hike"", ""A subreddit for cute and cuddly pictures"", ""Conservative"", ""Conservative"", ""Conservative"", ""Conservative"", ""President Donald Trump - Trump 2020! - Election Defense Task Force - Stop The Steal!"", ""President Donald Trump - Trump 2020! - Election Defense Task Force - Stop The Steal!"", ""Georgia Camp and Hike"", ""Conservative"", ""Conservative"", ""Conservative"", ""DRAIN the SWAMP"", ""Murdered By Words"", ""Conservative""]";
Dantronicus;President Donald Trump - Trump 2020! - Election Defense Task Force - Stop The Steal!;Oh man. That's gold. Haha.;"[""ActualPublicFreakouts"", ""ActualPublicFreakouts"", ""Do NOT mess with these tough people."", ""/r/PublicFreakout"", ""Watch People Die Inside"", ""ActualPublicFreakouts"", ""Where everyone is a quantum scientist..."", ""/r/PublicFreakout"", ""conspiracy"", ""conspiracy"", ""/r/PublicFreakout"", ""ActualPublicFreakouts"", ""conspiracy"", ""conspiracy"", ""ActualPublicFreakouts"", ""conspiracy"", ""Talk shit, get hit."", ""/r/PublicFreakout"", ""conspiracy"", ""Talk shit, get hit."", ""ActualPublicFreakouts"", ""conspiracy"", ""ActualPublicFreakouts"", ""conspiracy"", ""Talk shit, get hit."", ""Talk shit, get hit."", ""conspiracy"", ""conspiracy"", ""conspiracy"", ""/r/PublicFreakout"", ""ActualPublicFreakouts"", ""conspiracy"", ""conspiracy"", ""/r/conspiracytheories"", ""/r/PublicFreakout"", ""conspiracy"", ""conspiracy"", ""Where everyone is a quantum scientist..."", ""/r/PublicFreakout"", ""conspiracy"", ""/r/PublicFreakout"", ""ActualPublicFreakouts"", ""conspiracy"", ""conspiracy"", ""/r/PublicFreakout"", ""ActualPublicFreakouts"", ""Watch People Die Inside"", ""conspiracy"", ""Psychedelics, Discussing natural and synthetic!"", ""ActualPublicFreakouts""]";
JoStonesoul;President Donald Trump - Trump 2020! - Election Defense Task Force - Stop The Steal!;"Technically he would have said, ""The Regulars are coming,"" or ""The Red Coats are coming.""

We were still under the rule of The King so saying the British were coming would also include themselves. I think he would have made a distinction.

But there are those who believe that at this point in time they considered themselves Colonialists so he may have said British. Who knows.";"[""/r/Memes the original since 2008"", ""bonehurtingjuice"", ""/r/Memes the original since 2008"", ""/r/Memes the original since 2008"", ""dankmemes"", ""firefly"", ""/r/Memes the original since 2008"", ""What Could Possibly Go Wrong?"", ""ThanosDidNothingWrong"", ""What Could Possibly Go Wrong?"", ""dankmemes"", ""the thicker the skin, the better the roast"", ""What Could Possibly Go Wrong?"", ""What Could Possibly Go Wrong?"", ""hockey: the best game on earth. Chat the NHL, AHL, KHL, NWHL, IIHF and more!"", ""Libertarian Meme"", ""All posts must be related to gun politics; civil discussion is expected"", ""Libertarian Meme"", ""Farscape"", ""/r/Memes the original since 2008"", ""/r/Memes the original since 2008"", ""What Could Possibly Go Wrong?"", ""/r/Memes the original since 2008"", ""What Could Possibly Go Wrong?"", ""/r/Memes the original since 2008"", ""Jokes: Get Your Funny On!"", ""/r/Memes the original since 2008"", ""/r/Memes the original since 2008"", ""What Could Possibly Go Wrong?"", ""firefly"", ""All posts must be related to gun politics; civil discussion is expected"", ""/r/Memes the original since 2008"", ""hockey: the best game on earth. Chat the NHL, AHL, KHL, NWHL, IIHF and more!"", ""VALUABLE DISCUSSION"", ""firefly"", ""VALUABLE DISCUSSION"", ""What Could Possibly Go Wrong?"", ""/r/Memes the original since 2008"", ""What Could Possibly Go Wrong?"", ""firefly"", ""All posts must be related to gun politics; civil discussion is expected"", ""For Verified Models in Cosplay Performing in Nudity and Sex"", ""Reddit Pics"", ""Libertarian Meme"", ""r/Libertarian: For a Free Society"", ""/r/Memes the original since 2008"", ""firefly"", ""Libertarian Meme"", ""firefly"", ""What Could Possibly Go Wrong?""]";
anonberet;President Donald Trump - Trump 2020! - Election Defense Task Force - Stop The Steal!;This is so ignorant. There’s absolutely no evidence of voter fraud-your guy is just a sore loser. You guys hate science and facts so much. Grow up and tell orange Cheeto head to move out so a REAL President can run the country;"[""World News"", ""The Right Can't Meme"", ""Philadelphia"", ""All news, US and international."", ""The Right Can't Meme"", ""Politics"", ""Democrats: Unite for a Better Future"", ""Change My View (CMV)"", ""All news, US and international."", ""Politics"", ""HorriblyDepressing"", ""My 600-lb Life"", ""The Right Can't Meme"", ""Politics"", ""Politics"", ""World News"", ""The Right Can't Meme"", ""Change My View (CMV)"", ""Politics"", ""Reddit Pics"", ""Snarkiness about the abomination that is 90 day fiance welcome "", ""Politics"", ""My 600-lb Life"", ""Politics"", ""Today I Fucked Up"", ""Politics"", ""\ud835\udcd1\ud835\udcf5\ud835\udcea\ud835\udcec\ud835\udcf4 \ud835\udce3\ud835\udcee\ud835\udcea"", ""Relationship Advice"", ""Everything about Tinder"", ""Sugar Lifestyle Forum"", ""Politics"", ""Politics"", ""All news, US and international."", ""Everything about Tinder"", ""Personal Finance"", ""Map Porn, for interesting maps"", ""World News"", ""Incels Without the Hate"", ""All news, US and international."", ""Politics"", ""Everything about Tinder"", ""Everything about Tinder"", ""\ud835\udcd1\ud835\udcf5\ud835\udcea\ud835\udcec\ud835\udcf4 \ud835\udce3\ud835\udcee\ud835\udcea"", ""All news, US and international."", ""Relationship Advice"", ""CoronavirusUS"", ""Financial news and views"", ""Politics"", ""Relationship Advice"", ""Politics""]";
Truth_SeekingMissile;President Donald Trump - Trump 2020! - Election Defense Task Force - Stop The Steal!;"Just picked up ""Wealth of Nations"". Nice theories '@AdamSmith you dick. We should have UBI and not oppressive global capitalism! Exploiters of the poor!";"[""Reddit Pics"", ""Future(s) Studies"", ""Jordan Peterson: Descensus ad inferos"", ""Seattle's Reddit Community"", ""Jordan Peterson: Descensus ad inferos"", ""Catastrophic Failure"", ""Seattle"", ""SocialJusticeInAction"", ""Conservative"", ""SocialJusticeInAction"", ""Seattle's Reddit Community"", ""Conservative"", ""Seattle's Reddit Community"", ""Heavy Metal Memes"", ""Jordan Peterson: Descensus ad inferos"", ""Hillary Clinton For Prison: WHERE SHE BELONGS"", ""Hold my fries while I..."", ""Maps of Memeing"", ""Seattle's Reddit Community"", ""Go Hawks!"", ""Seattle's Reddit Community"", ""Conservative"", ""Hillary Clinton For Prison: WHERE SHE BELONGS"", ""Seattle's Reddit Community"", ""For your Opinions that are Unpopular "", ""Future(s) Studies"", ""Let's hope you didn't vote for the pedo"", ""Reddit Science"", ""Conservative"", ""For your Opinions that are Unpopular "", ""Steven Crowder"", ""Reddit Pics"", ""NFL: National Football League Discussion"", ""Space Discussion"", ""Libertarian Meme"", ""Let's hope you didn't vote for the pedo"", ""Seattle's Reddit Community"", ""/r/worldpolitics"", ""Propaganda Posters"", ""Tucker Carlson: The Sworn Enemy of Lying, Pomposity, Smugness & Groupthink"", ""Seattle's Reddit Community"", ""Reddit Pics"", ""Reddit Pics"", ""SocialJusticeInAction"", ""Heavy Metal Memes"", ""Conservative"", ""Go Hawks!"", ""Seattle's Reddit Community"", ""Jordan Peterson: Descensus ad inferos"", ""ProgMetal: Progressive Metal Community""]";
ultraman7676;President Donald Trump - Trump 2020! - Election Defense Task Force - Stop The Steal!;That’s how Biden works right he gives and taketh thy blackness;"[""r/teenagers"", ""/r/Memes the original since 2008"", ""Super Smash Bros."", ""PrequelMemes - Memes of the Star Wars Prequels"", ""/r/PewdiepieSubmissions"", ""/r/Memes the original since 2008"", ""/r/Memes the original since 2008"", ""/r/Memes the original since 2008"", ""/r/PewdiepieSubmissions"", ""Internet for the Spirit"", ""/r/Memes the original since 2008"", ""/r/PewdiepieSubmissions"", ""/r/Memes the original since 2008"", ""/r/Memes the original since 2008"", ""\u2b06 Next Fucking Level \u2b06"", ""/r/Memes the original since 2008"", ""/r/Memes the original since 2008"", ""/r/PewdiepieSubmissions"", ""/r/Memes the original since 2008"", ""/r/Memes the original since 2008"", ""r/teenagers"", ""PrequelMemes - Memes of the Star Wars Prequels"", ""/r/PewdiepieSubmissions"", ""/r/PewdiepieSubmissions"", ""Minecraft on reddit"", ""/r/PewdiepieSubmissions"", ""/r/Memes the original since 2008"", ""/r/Memes the original since 2008"", ""/r/Memes the original since 2008"", ""/r/Memes the original since 2008"", ""/r/Memes the original since 2008"", ""/r/PewdiepieSubmissions"", ""Super Smash Bros. Ultimate"", ""Internet for the Spirit"", ""r/teenagers"", ""/r/Memes the original since 2008"", ""/r/PewdiepieSubmissions"", ""Super Smash Bros. Ultimate"", ""/r/Memes the original since 2008"", ""/r/Memes the original since 2008"", ""/r/Memes the original since 2008"", ""Ask Reddit..."", ""/r/PewdiepieSubmissions"", ""JoJo's Bizarre Shitposts"", ""/r/Memes the original since 2008"", ""JoJo's Bizarre Shitposts"", ""/r/Memes the original since 2008"", ""/r/PewdiepieSubmissions"", ""r/teenagers"", ""JoJo's Bizarre Shitposts""]";
Bluika;President Donald Trump - Trump 2020! - Election Defense Task Force - Stop The Steal!;All she had to was support Biden. It's that easy apparently.;"[""Conservative"", ""saltierthancrait"", ""Unresolved Mysteries"", ""Conservative"", ""Conservative"", ""Conservative"", ""better Call Saul! "", ""Conservative"", ""better Call Saul! "", ""Conservative"", ""Conservative"", ""Conservative"", ""Conservative"", ""Conservative"", ""Conservative"", ""Conservative"", ""Conservative"", ""Conservative"", ""saltierthancrait"", ""Conservative"", ""DC Cinematic"", ""Conservative"", ""Conservative"", ""Conservative"", ""Conservative"", ""Conservative"", ""Conservative"", ""Conservative"", ""Conservative"", ""Conservative"", ""President Donald Trump - Trump 2020! - Election Defense Task Force - Stop The Steal!"", ""Conservative"", ""Conservative"", ""saltierthancrait"", ""Conservative"", ""better Call Saul! "", ""Conservative"", ""DC Cinematic"", ""Conservative"", ""Conservative"", ""saltierthancrait"", ""Conservative"", ""Conservative"", ""Conservative"", ""Conservative"", ""President Donald Trump - Trump 2020! - Election Defense Task Force - Stop The Steal!"", ""Conservative"", ""Conservative"", ""Star Wars Speculation: A Place to Speculate on all aspects of the Star Wars Universe"", ""Conservative""]";
3_Creepio;President Donald Trump - Trump 2020! - Election Defense Task Force - Stop The Steal!;For left-wing purposes, the word “first” is the most important in both instances, because in both cases it allows them to highlight identity politics over anything truly meaningful, and it also allows them to pat each other on the back for using their mighty Bulldozer of Wokeness to break down the barriers of the evil racist patriarchy. And that’s it. That’s all that matters in these headlines. They don’t really care about anything else anymore.;"[""r/TheWalkingDead"", ""All posts must be related to gun politics; civil discussion is expected"", ""Conservative"", ""/r/KitchenConfidential: Restaurants and Restaurant Workers"", ""/r/fantasyfootball - Good For Your Season"", ""Conservative"", ""Beer"", ""All posts must be related to gun politics; civil discussion is expected"", ""Conservative"", ""/r/KitchenConfidential: Restaurants and Restaurant Workers"", ""/r/KitchenConfidential: Restaurants and Restaurant Workers"", ""Conservative"", ""Amazin', Amazin', Amazin'"", ""Hold My Feeding Tube"", ""/r/fantasyfootball - Good For Your Season"", ""Beer"", ""Deadwood: Our Pours are Square"", ""Amazin', Amazin', Amazin'"", ""/r/fantasyfootball - Good For Your Season"", ""Amazin', Amazin', Amazin'"", ""President Donald Trump - Trump 2020! - Election Defense Task Force - Stop The Steal!"", ""Syracuse: The Salt City"", ""Conservative"", ""New York Giants on Reddit"", ""Amazin', Amazin', Amazin'"", ""Amazin', Amazin', Amazin'"", ""/r/KitchenConfidential: Restaurants and Restaurant Workers"", ""Conservative"", ""Beer"", ""Syracuse: The Salt City"", ""Movie News and Discussion"", ""Conservative"", ""Welcome to /r/Food on Reddit!"", ""/r/KitchenConfidential: Restaurants and Restaurant Workers"", ""/r/KitchenConfidential: Restaurants and Restaurant Workers"", ""Movie News and Discussion"", ""scifi"", ""All things about the band U2"", ""AskThe_Donald"", ""Oak Island mysteries redditted here. CROWN TIME"", ""All posts must be related to gun politics; civil discussion is expected"", ""AskThe_Donald"", ""Conservative"", ""/r/fantasyfootball - Good For Your Season"", ""Yellowstone TV Series"", ""The_Congress"", ""Plata o Plomo"", ""/r/KitchenConfidential: Restaurants and Restaurant Workers"", ""All things about the band U2"", ""Deadwood: Our Pours are Square""]";
SupremeDearLeader;President Donald Trump - Trump 2020! - Election Defense Task Force - Stop The Steal!;Her wiki page also used to list her as childless,  now POOF she is a loving stepmother to kids whose ages she can't remember on the spot ...lol;"[""Now with less politics!"", ""Lightly used "", ""All posts must be related to gun politics; civil discussion is expected"", ""Botched Surgeries "", ""Botched Surgeries "", ""90 Day Fiance"", ""Conservative"", ""90 Day Fiance"", ""Bad MakeUp Artists"", ""Botched Surgeries "", ""Conservative"", ""Nature is Metal"", ""90 Day Fiance"", ""WalkAway"", ""90 Day Fiance"", ""Botched Surgeries "", ""Botched Surgeries "", ""The Downsides of Modern Development"", ""90 Day Fiance"", ""For the best of the worst LuLaRo patterns."", ""Bad MakeUp Artists"", ""Now with less politics!"", ""Conservative"", ""Conservative"", ""90 Day Fiance"", ""90 Day Fiance"", ""Botched Surgeries "", ""Ghetto Glamour Shots"", ""Conservative"", ""Conservative"", ""Botched Surgeries "", ""90 Day Fiance"", ""90 Day Fiance"", ""Conservative"", ""Aquariums"", ""Conservative"", ""Conservative"", ""Conservative"", ""Pet Rats"", ""Conservative"", ""Conservative"", ""Conservative"", ""LoveForLandlords"", ""90 Day Fiance"", ""90 Day Fiance"", ""\""Love After Lockup\"" on WETV "", ""90 Day Fiance"", ""Botched Surgeries "", ""90 Day Fiance"", ""Botched Surgeries ""]";
DeepAnus69;President Donald Trump - Trump 2020! - Election Defense Task Force - Stop The Steal!;She's voting for Biden, so that would explain it.;"[""Instant Karma"", ""Instant Karma"", ""/r/PublicFreakout"", ""Cursed Comments"", ""Instant Karma"", ""/r/PublicFreakout"", ""Make Me Suffer"", ""/r/PublicFreakout"", ""Everything about Tinder"", ""Make Me Suffer"", ""Cursed Comments"", ""All posts must be related to gun politics; civil discussion is expected"", ""Watch Reddit Die"", ""Everything about Tinder"", ""Cursed Comments"", ""Ask Reddit..."", ""Everything about Tinder"", ""Today I Fucked Up"", ""UsernameChecksOut"", ""Instant Karma"", ""UsernameChecksOut"", ""Two-Sentence Horror Stories: Bite-sized scares. "", ""the thicker the skin, the better the roast"", ""Two-Sentence Horror Stories: Bite-sized scares. "", ""Everything about Tinder"", ""SuddenlyIncest"", ""UsernameChecksOut"", ""Borderlands"", ""Brand New Sentence"", ""Today I Fucked Up"", ""Make Me Suffer"", ""Would You Rather"", ""Am I the Asshole? "", ""The home of heartfelt messages from questionable sources"", ""Today I Fucked Up"", ""For your Opinions that are Unpopular "", ""NoahGetTheDeathStar"", ""cursed_images"", ""Tucker Carlson: The Sworn Enemy of Lying, Pomposity, Smugness & Groupthink"", ""Borderlands"", ""Instant Karma"", ""Make Me Suffer"", ""Tucker Carlson: The Sworn Enemy of Lying, Pomposity, Smugness & Groupthink"", ""Noah's Ark"", ""Brand New Sentence"", ""Everything about Tinder"", ""TheQuartering "", ""Instant Karma"", ""Today I Fucked Up"", ""Tucker Carlson: The Sworn Enemy of Lying, Pomposity, Smugness & Groupthink""]";
4-me;President Donald Trump - Trump 2020! - Election Defense Task Force - Stop The Steal!;Until that guy last week insulted those Indian cakes... then she was Indian again.;"[""A subreddit for cute and cuddly pictures"", ""funny"", ""A subreddit for cute and cuddly pictures"", ""A subreddit for cute and cuddly pictures"", ""For the identification of mysterious objects"", ""A subreddit for cute and cuddly pictures"", ""funny"", ""funny"", ""A subreddit for cute and cuddly pictures"", ""A subreddit for cute and cuddly pictures"", ""A subreddit for cute and cuddly pictures"", ""Beggars can't be choosers!"", ""funny"", ""A subreddit for cute and cuddly pictures"", ""A subreddit for cute and cuddly pictures"", ""A subreddit for cute and cuddly pictures"", ""LEGO - News from a Studded World"", ""A subreddit for cute and cuddly pictures"", ""A subreddit for cute and cuddly pictures"", ""A subreddit for cute and cuddly pictures"", ""A subreddit for cute and cuddly pictures"", ""A subreddit for cute and cuddly pictures"", ""Personal Finance"", ""A subreddit for cute and cuddly pictures"", ""A subreddit for cute and cuddly pictures"", ""For the identification of mysterious objects"", ""Frugal Living: Waste Less-Gain More!"", ""A subreddit for cute and cuddly pictures"", ""funny"", ""A subreddit for cute and cuddly pictures"", ""funny"", ""funny"", ""financial independence / early retirement"", ""A subreddit for cute and cuddly pictures"", ""A subreddit for cute and cuddly pictures"", ""LEGO - News from a Studded World"", ""A subreddit for cute and cuddly pictures"", ""A subreddit for cute and cuddly pictures"", ""A subreddit for cute and cuddly pictures"", ""DIY"", ""All things Bravo & Real Housewives!"", ""A subreddit for cute and cuddly pictures"", ""All things Bravo & Real Housewives!"", ""A subreddit for cute and cuddly pictures"", ""A subreddit for cute and cuddly pictures"", ""A subreddit for cute and cuddly pictures"", ""A subreddit for cute and cuddly pictures"", ""LEGO - News from a Studded World"", ""funny"", ""funny""]";
imafarttrustme;President Donald Trump - Trump 2020! - Election Defense Task Force - Stop The Steal!;She took that same DNA test Fauxcahontas took a while back. The results concluded that the only African DNA found in her belonged to Willie Brown.;"[""Ask Reddit..."", ""WTF?!"", ""Ask Reddit..."", ""Enhancing food with wood smoke flavor"", ""President Donald Trump - Trump 2020! - Election Defense Task Force - Stop The Steal!"", ""Ask Reddit..."", ""Ask Reddit..."", ""Ask Reddit..."", ""President Donald Trump - Trump 2020! - Election Defense Task Force - Stop The Steal!"", ""Ask Reddit..."", ""/r/cringepics: when it hurts just to look"", ""Ask Reddit..."", ""President Donald Trump - Trump 2020! - Election Defense Task Force - Stop The Steal!"", ""Ask Reddit..."", ""Ask Reddit..."", ""President Donald Trump - Trump 2020! - Election Defense Task Force - Stop The Steal!"", ""President Donald Trump - Trump 2020! - Election Defense Task Force - Stop The Steal!"", ""funny"", ""Ask Reddit..."", ""President Donald Trump - Trump 2020! - Election Defense Task Force - Stop The Steal!"", ""Enhancing food with wood smoke flavor"", ""Ask Reddit..."", ""/r/cringepics: when it hurts just to look"", ""President Donald Trump - Trump 2020! - Election Defense Task Force - Stop The Steal!"", ""#1 Source for all things DIY eJuice"", ""President Donald Trump - Trump 2020! - Election Defense Task Force - Stop The Steal!"", ""President Donald Trump - Trump 2020! - Election Defense Task Force - Stop The Steal!"", ""Ask Reddit..."", ""President Donald Trump - Trump 2020! - Election Defense Task Force - Stop The Steal!"", ""President Donald Trump - Trump 2020! - Election Defense Task Force - Stop The Steal!"", ""Ask Reddit..."", ""President Donald Trump - Trump 2020! - Election Defense Task Force - Stop The Steal!"", ""Enhancing food with wood smoke flavor"", ""President Donald Trump - Trump 2020! - Election Defense Task Force - Stop The Steal!"", ""Ask Reddit..."", ""President Donald Trump - Trump 2020! - Election Defense Task Force - Stop The Steal!"", ""President Donald Trump - Trump 2020! - Election Defense Task Force - Stop The Steal!"", ""President Donald Trump - Trump 2020! - Election Defense Task Force - Stop The Steal!"", ""President Donald Trump - Trump 2020! - Election Defense Task Force - Stop The Steal!"", ""President Donald Trump - Trump 2020! - Election Defense Task Force - Stop The Steal!"", ""President Donald Trump - Trump 2020! - Election Defense Task Force - Stop The Steal!"", ""Ask Reddit..."", ""DRAIN the SWAMP"", ""Aquariums"", ""/r/cringepics: when it hurts just to look"", ""Ask Reddit..."", ""President Donald Trump - Trump 2020! - Election Defense Task Force - Stop The Steal!"", ""President Donald Trump - Trump 2020! - Election Defense Task Force - Stop The Steal!"", ""President Donald Trump - Trump 2020! - Election Defense Task Force - Stop The Steal!"", ""Ask Reddit...""]";
HybridMemer;President Donald Trump - Trump 2020! - Election Defense Task Force - Stop The Steal!;Someone gave her the n word pass but whom?;"[""/r/PewdiepieSubmissions"", ""Minecraft on reddit"", ""/r/Memes the original since 2008"", ""/r/Memes the original since 2008"", ""/r/Memes the original since 2008"", ""Minecraft on reddit"", ""/r/Memes the original since 2008"", ""Minecraft on reddit"", ""/r/Memes the original since 2008"", ""Minecraft on reddit"", ""/r/Memes the original since 2008"", ""Minecraft Seeds"", ""/r/PewdiepieSubmissions"", ""/r/PewdiepieSubmissions"", ""/r/PewdiepieSubmissions"", ""Minecraft on reddit"", ""/r/Memes the original since 2008"", ""Minecraft on reddit"", ""/r/Memes the original since 2008"", ""/r/Memes the original since 2008"", ""/r/Memes the original since 2008"", ""Minecraft Seeds"", ""President Donald Trump - Trump 2020! - Election Defense Task Force - Stop The Steal!"", ""/r/Memes the original since 2008"", ""/r/PewdiepieSubmissions"", ""Minecraft on reddit"", ""/r/Memes the original since 2008"", ""Minecraft on reddit"", ""Minecraft on reddit"", ""/r/PewdiepieSubmissions"", ""/r/PewdiepieSubmissions"", ""/r/PewdiepieSubmissions"", ""The Official Jacksepticeye Subreddit"", ""Minecraft Seeds"", ""Minecraft on reddit"", ""Minecraft on reddit"", ""Blursed Images"", ""selfies of the soul"", ""JackSucksAtLife"", ""/r/Memes the original since 2008"", ""/r/Memes the original since 2008"", ""/r/PewdiepieSubmissions"", ""/r/PewdiepieSubmissions"", ""selfies of the soul"", ""/r/Memes the original since 2008"", ""President Donald Trump - Trump 2020! - Election Defense Task Force - Stop The Steal!"", ""/r/Memes the original since 2008"", ""Minecraft Seeds"", ""/r/Memes the original since 2008"", ""/r/Memes the original since 2008""]";
mickeybuilds;President Donald Trump - Trump 2020! - Election Defense Task Force - Stop The Steal!;She's both and chooses whichever one gives her a benefit at the time. Kinda like Elizabeth Warren being native ameri-....lol jk that bitch is white af and there's no benefit in that skin tone.;"[""Jokes: Get Your Funny On!"", ""Jokes: Get Your Funny On!"", ""WTF?!"", ""r/gaming"", ""/r/PublicFreakout"", ""Awful Taste But Great Execution"", ""Reddit Pics"", ""Jokes: Get Your Funny On!"", ""PhotoshopBattles"", ""PhotoshopBattles"", ""Sadly, this is not the Onion."", ""PhotoshopBattles"", ""PhotoshopBattles"", "".gifs - funny, animated gifs for your viewing pleasure"", ""PhotoshopBattles"", "">greentext"", ""Jokes: Get Your Funny On!"", ""PhotoshopBattles"", ""All news, US and international."", ""World News"", ""Today I Learned (TIL)"", ""PhotoshopBattles"", ""PhotoshopBattles"", ""PhotoshopBattles"", ""Reddit Pics"", ""Movie News and Discussion"", "".gifs - funny, animated gifs for your viewing pleasure"", ""Jokes: Get Your Funny On!"", ""ActualPublicFreakouts"", ""Reddit Pics"", ""PhotoshopBattles"", ""the thicker the skin, the better the roast"", ""PhotoshopBattles"", ""History"", ""Jokes: Get Your Funny On!"", ""Reddit Sports"", ""Today I Learned (TIL)"", ""PhotoshopBattles"", ""funny"", ""Interesting As Fuck"", "".gifs - funny, animated gifs for your viewing pleasure"", ""the thicker the skin, the better the roast"", ""Jokes: Get Your Funny On!"", "">greentext"", ""Today I Learned (TIL)"", ""funny"", ""funny"", ""Talk shit, get hit."", ""Today I Learned (TIL)"", ""PhotoshopBattles""]";
