user;from_subreddit;comment;used_subreddits;comment_sentiment
3rdtimeischarmy;President-elect Joe Biden;"Trump supporters for the last 4 years: ""Get over it snowflake, we won."" 

Trump supporters now: ""whaaaaaaa, rigged, whaaaaaa, radical left, whaaaaaaa.""";"[""Politics"", ""Politics"", ""Politics"", ""Politics"", ""/r/worldpolitics"", ""White People Twitter"", ""A gallery of inexplicable stupidity"", ""Politics"", ""35,000+ Tweets, No Self Awareness"", ""Politics"", ""Politics"", ""Politics"", ""Ask Reddit..."", ""Politics"", ""ApplyingToCollege"", ""Politics"", ""Politics"", ""Politics"", ""White People Twitter"", ""White People Twitter"", ""atheism"", ""Ask Reddit..."", ""Provisional Conspiracy Sub"", ""ApplyingToCollege"", ""selfies of the soul"", ""/r/worldpolitics"", ""Everything & Anything You Were Too Afraid To Ask"", ""Ask Reddit..."", ""conspiracy"", ""ApplyingToCollege"", ""Politics"", ""conspiracy"", ""ApplyingToCollege"", ""Politics"", ""Politics"", ""Politics"", ""Politics"", ""35,000+ Tweets, No Self Awareness"", ""Politics"", ""Ask Reddit..."", ""/r/PublicFreakout"", ""conspiracy"", ""Eating healthy on a cheap budget"", ""President-elect Joe Biden"", ""35,000+ Tweets, No Self Awareness"", ""Politics"", ""Politics"", ""Politics"", ""Canada"", ""Everything & Anything You Were Too Afraid To Ask""]";
FuzzyLaughter;President-elect Joe Biden;I am shaking! So freakin’ happy. Let’s hope it sticks, and that PA gets more Biden friendly batches. Almost there!;"[""Peloton Community | We're better together"", ""President-elect Joe Biden"", ""President-elect Joe Biden"", ""President-elect Joe Biden"", ""Politics"", ""Peloton Community | We're better together"", ""President-elect Joe Biden"", ""President-elect Joe Biden"", ""Peloton Community | We're better together"", ""Peloton Community | We're better together"", ""President-elect Joe Biden"", ""President-elect Joe Biden"", ""Peloton Community | We're better together"", ""Peloton Community | We're better together"", ""President-elect Joe Biden"", ""Peloton Community | We're better together"", ""President-elect Joe Biden"", ""Peloton Community | We're better together"", ""Peloton Community | We're better together"", ""Peloton Community | We're better together"", ""President-elect Joe Biden"", ""Peloton Community | We're better together"", ""Peloton Community | We're better together"", ""President-elect Joe Biden"", ""Peloton Community | We're better together"", ""President-elect Joe Biden"", ""President-elect Joe Biden"", ""Peloton Community | We're better together"", ""Peloton Community | We're better together"", ""President-elect Joe Biden"", ""Peloton Community | We're better together"", ""Peloton Community | We're better together"", ""Peloton Community | We're better together"", ""Peloton Community | We're better together"", ""Peloton Community | We're better together"", ""Peloton Community | We're better together"", ""Peloton Community | We're better together"", ""Peloton Community | We're better together"", ""President-elect Joe Biden"", ""President-elect Joe Biden"", ""Peloton Community | We're better together"", ""Peloton Community | We're better together"", ""Peloton Community | We're better together"", ""Peloton Community | We're better together"", ""Peloton Community | We're better together"", ""President-elect Joe Biden"", ""Peloton Community | We're better together"", ""Peloton Community | We're better together"", ""Peloton Community | We're better together"", ""Peloton Community | We're better together""]";
Beta_Soyboy_Cuck;President-elect Joe Biden;Rest in power John Lewis. You did your part, you’ve earned the rest.;"[""Politics"", ""President-elect Joe Biden"", ""/r/Vegan - the largest vegan community on the internet!"", ""President-elect Joe Biden"", ""Insane People on Facebook"", ""President-elect Joe Biden"", ""MadeMeSmile"", ""The Ideological Trashcan"", ""byebyejob"", ""President-elect Joe Biden"", ""Vegan Circlejerk"", ""Politics"", ""Politics"", ""Politics"", ""Breadit: home bread baking at its finest"", ""Politics"", ""Politics"", ""Politics"", ""Sid Meier's Civilization"", ""President-elect Joe Biden"", ""President-elect Joe Biden"", ""Dark Souls"", ""Elizabeth Warren"", ""Missouri"", ""The Ideological Trashcan"", ""Politics"", ""Politics"", ""Vegan Circlejerk"", ""Missouri"", ""byebyejob"", ""Politics"", ""Politics"", ""Missouri"", ""President-elect Joe Biden"", ""Wisconsin: News from the Badger State"", ""President-elect Joe Biden"", ""Politics"", ""The only true racism is racism against wh*tes."", ""Politics"", ""Vegan fitness"", ""Vegan Circlejerk"", ""foodscam"", ""foodscam"", ""The Ideological Trashcan"", ""Enough_Sanders_Spam"", ""President-elect Joe Biden"", ""/r/Vegan - the largest vegan community on the internet!"", ""/r/Vegan - the largest vegan community on the internet!"", ""A gallery of inexplicable stupidity"", ""Politics""]";
nylawman21;President-elect Joe Biden;"ATTENTION GEORGIA VOTERS! If you voted absentee check the status of your ballot NOW!

If it was REJECTED...you have until 5pm on FRIDAY 11/6 to fix it.

https://georgia.ballottrax.net/voter/";"[""A Song of Ice and Fire"", ""All news, US and international."", ""MovieDetails"", ""Politics"", ""WTF?!"", ""WTF?!"", ""QuotesPorn"", ""Walt Disney World - The Most Magical Subreddit on Earth!"", ""Game of Thrones"", ""Would You Rather"", ""MovieDetails"", ""Politics"", ""Future(s) Studies"", ""President-elect Joe Biden"", ""New York Rangers"", ""Idiots Nearly Dying"", ""A Song of Ice and Fire"", ""/r/PlayItAgainSam - Did you catch that?!"", ""MovieDetails"", ""New York Rangers"", ""A Place For Friendly And Supportive Conversations Between Over 30 Adults"", ""r/esist"", ""New York Rangers"", ""MovieDetails"", ""New York Rangers"", ""Walt Disney World - The Most Magical Subreddit on Earth!"", ""WTF?!"", ""New York Rangers"", ""Walt Disney World - The Most Magical Subreddit on Earth!"", ""r/esist"", ""New York Rangers"", ""New York Rangers"", ""Walt Disney World - The Most Magical Subreddit on Earth!"", ""Walt Disney World - The Most Magical Subreddit on Earth!"", ""Walt Disney World - The Most Magical Subreddit on Earth!"", ""Daddit"", ""All news, US and international."", ""Walt Disney World - The Most Magical Subreddit on Earth!"", ""New York Rangers"", ""Walt Disney World - The Most Magical Subreddit on Earth!"", ""A Place For Friendly And Supportive Conversations Between Over 30 Adults"", ""Walt Disney World - The Most Magical Subreddit on Earth!"", ""Walt Disney World - The Most Magical Subreddit on Earth!"", ""New York Rangers"", ""New York Rangers"", ""The Best and Worst of TikTok"", ""New York Rangers"", ""Walt Disney World - The Most Magical Subreddit on Earth!"", ""Walt Disney World - The Most Magical Subreddit on Earth!"", ""Happy Crowds, Responsive Audiences, and Participating Patrons""]";
AutoBot5;President-elect Joe Biden;Better believe the great John Lewis and John McCain are drinking some top shelf shit right now!  🇺🇸🙌;"[""/r/cringepics: when it hurts just to look"", ""Talk shit, get hit."", ""PlayStation 5 - News \u2022 Discussion \u2022 Community"", ""Ask Women Advice "", ""Reddit Pics"", ""Relationships"", ""r/iPhone"", ""Relationship Advice"", ""Politics"", ""/r/PublicFreakout"", ""The Best and Worst of TikTok"", ""/r/PublicFreakout"", ""President-elect Joe Biden"", ""When it just hurts to watch"", ""Talk shit, get hit."", ""Reddit Pics"", ""When it just hurts to watch"", ""Politics"", ""Politics"", ""/r/cringepics: when it hurts just to look"", ""r/gaming"", ""funny"", ""Are you seeing this shit?"", ""Apple Watch"", ""Aged Like Milk "", ""Cringetopia"", ""Ubiquiti Networks"", ""Talk shit, get hit."", ""Apple Watch"", ""A place for Sonos users"", ""President-elect Joe Biden"", ""byebyejob"", ""PlayStation 5 - News \u2022 Discussion \u2022 Community"", ""Politics"", ""Ask Women Advice "", ""President-elect Joe Biden"", ""/r/PublicFreakout"", ""/r/PublicFreakout"", ""/r/cringepics: when it hurts just to look"", ""When it just hurts to watch"", ""/r/PublicFreakout"", ""Watch People Die Inside"", ""Now with less politics!"", ""When it just hurts to watch"", ""\u2b06 Next Fucking Level \u2b06"", ""/r/cringepics: when it hurts just to look"", ""President-elect Joe Biden"", ""News and Discussion about Politics in the Lone Star State"", ""/r/PublicFreakout"", ""When it just hurts to watch""]";
BoomerThooner;President-elect Joe Biden;Legend John Lewis! Defeating and battling systemic racism in life and death!!!! What a boss!;"[""BlackPeopleTwitter"", ""Television News and Discussion"", ""Politics"", ""MovieDetails"", ""Politics"", ""BlackPeopleTwitter"", ""The Internet's Tailgate"", ""Future(s) Studies"", ""BlackPeopleTwitter"", ""Politics"", ""All news, US and international."", ""Politics"", ""The Flash"", ""Call of Duty: Modern Warfare | Reddit"", ""Reddit Science"", ""NBA"", ""The Internet's Tailgate"", ""Politics"", ""There was an attempt.."", ""The Flash"", ""Today I Learned (TIL)"", ""Politics"", ""The Internet's Tailgate"", ""Marvel's Spider-Man"", ""Political Discussion"", ""The Internet's Tailgate"", ""Politics"", ""2020 Political Hindsight - a Donald Trump lovefest"", ""BlackPeopleTwitter"", ""Insane People on Facebook"", ""Star Wars - A long time ago, in a galaxy far, far, away..."", ""Politics"", ""Politics"", ""Entertainment"", ""/r/CollegeBasketball: The Internet's Student Section"", ""World News"", ""Politics"", ""World News"", ""dankmemes"", ""The Internet's Tailgate"", ""What Could Possibly Go Wrong?"", ""NFL: National Football League Discussion"", ""Television News and Discussion"", ""Sid Meier's Civilization"", ""BlackPeopleTwitter"", ""Teachers"", ""BlackPeopleTwitter"", ""White People Twitter"", ""MovieDetails"", ""Politics""]";
Talib00n;President-elect Joe Biden;"Rep. Lewis and Sen. Mccain really came trough for democracy in this election.
Shows that honorable Men and Women can have power for good even after their own lifes have ended.";"[""No Heresy November"", ""Official Destiny Subreddit"", ""The Ideological Trashcan"", ""No Heresy November"", ""dankmemes"", ""The Ideological Trashcan"", ""Official Destiny Subreddit"", ""Top. Minds."", ""r/de - Extraordin\u00e4r gut!"", ""Official Destiny Subreddit"", ""The Ideological Trashcan"", ""The Ideological Trashcan"", ""The Ideological Trashcan"", ""No Heresy November"", ""World News"", ""The Ideological Trashcan"", ""President-elect Joe Biden"", ""Der Schei\u00dfer: the Final Solution to the Shitpost Question"", ""Official Destiny Subreddit"", ""The Ideological Trashcan"", ""The Ideological Trashcan"", ""The Ideological Trashcan"", ""The Ideological Trashcan"", ""President-elect Joe Biden"", ""The Ideological Trashcan"", ""The Ideological Trashcan"", ""Politics"", ""Starcraft on Reddit"", ""President-elect Joe Biden"", ""The Ideological Trashcan"", ""No Heresy November"", ""The Ideological Trashcan"", ""The Ideological Trashcan"", ""The Ideological Trashcan"", ""The Ideological Trashcan"", ""The division of intelligence is limited by the extent of the internet"", ""Crusader Kings"", ""The Ideological Trashcan"", ""The Ideological Trashcan"", ""The Ideological Trashcan"", ""The Ideological Trashcan"", ""The Ideological Trashcan"", ""Politics"", ""Politics"", ""You have horses! What were you thinking?!"", ""Grimdank Warhammer 40,000 Memes"", ""Europa Universalis IV"", ""Der Schei\u00dfer: the Final Solution to the Shitpost Question"", ""Grimdank Warhammer 40,000 Memes"", ""Politics""]";
emergencycat17;President-elect Joe Biden;"I got a private message from a friend out in Alaska, and she said, ""It's like John Lewis and RBG are looking down at us and still protecting us, like a pair of guardian angels!""";"[""Ask Reddit..."", ""Jokes: Get Your Funny On!"", ""Humans just being bros"", ""People Person's Paper People"", ""Ask Reddit..."", ""Pro Revenge"", ""Ask Reddit..."", ""Ask Reddit..."", ""RuPaul's Drag Race"", ""Animals just being bros"", ""Animals just being bros"", ""AskWomen: Questions about women's thoughts, lives, and experiences"", ""Ask Reddit..."", ""All things Bravo & Real Housewives!"", ""All things Bravo & Real Housewives!"", ""Petty Revenge"", ""Jokes: Get Your Funny On!"", ""TalesFromRetail"", ""People Person's Paper People"", ""Startled Cats"", ""Outwit, Outplay, Out-upvote"", ""Ask Reddit..."", ""The Bachelor"", ""The Bachelor"", ""Today I Learned (TIL)"", ""TalesFromRetail"", ""IAmA"", ""AskWomen: Questions about women's thoughts, lives, and experiences"", ""Sadly, this is not the Onion."", ""Legal Advice ~ A place to get simple legal advice* "", ""Ask Reddit..."", ""AskWomen: Questions about women's thoughts, lives, and experiences"", ""Cats"", ""A subreddit for cute and cuddly pictures"", ""Pro Revenge"", ""Uplifting News"", ""TalesFromRetail"", ""The Bachelor"", ""The Bachelor"", ""The Bachelor"", ""The Bachelor"", ""The Bachelor"", ""r/TheWalkingDead"", ""The Bachelor"", ""The Bachelor"", ""All things Bravo & Real Housewives!"", ""Television News and Discussion"", ""r/TheWalkingDead"", ""Ask Reddit..."", ""RuPaul's Drag Race""]";
AFineYoungGent;President-elect Joe Biden;I woke up just in time to see this lovely.;"[""President-elect Joe Biden"", ""President-elect Joe Biden"", ""President-elect Joe Biden"", ""President-elect Joe Biden"", ""President-elect Joe Biden"", ""President-elect Joe Biden"", ""President-elect Joe Biden"", ""President-elect Joe Biden"", ""President-elect Joe Biden"", ""President-elect Joe Biden"", ""President-elect Joe Biden"", ""President-elect Joe Biden"", ""President-elect Joe Biden"", ""President-elect Joe Biden"", ""Dragalia Lost"", ""President-elect Joe Biden"", ""President-elect Joe Biden"", ""President-elect Joe Biden"", ""President-elect Joe Biden"", ""President-elect Joe Biden"", ""President-elect Joe Biden"", ""President-elect Joe Biden"", ""President-elect Joe Biden"", ""President-elect Joe Biden"", ""President-elect Joe Biden"", ""President-elect Joe Biden"", ""President-elect Joe Biden"", ""President-elect Joe Biden"", ""President-elect Joe Biden"", ""President-elect Joe Biden"", ""President-elect Joe Biden"", ""President-elect Joe Biden"", ""President-elect Joe Biden"", ""President-elect Joe Biden"", ""President-elect Joe Biden"", ""President-elect Joe Biden"", ""President-elect Joe Biden"", ""President-elect Joe Biden"", ""President-elect Joe Biden"", ""President-elect Joe Biden"", ""President-elect Joe Biden"", ""President-elect Joe Biden"", ""President-elect Joe Biden"", ""President-elect Joe Biden"", ""President-elect Joe Biden"", ""Forbidden Snacks"", ""President-elect Joe Biden"", ""President-elect Joe Biden"", ""President-elect Joe Biden"", ""President-elect Joe Biden""]";
MynaSpirit789;President-elect Joe Biden;“America will survive Trump,”...Thank You John Lewis. We couldn’t have been here without you.;"[""Politics"", ""Politics"", ""Politics"", ""I never thought leopards would eat MY face"", ""Politics"", ""Politics"", ""Politics"", ""Politics"", ""Politics"", ""Politics"", ""Politics"", ""Politics"", ""Politics"", ""Politics"", ""Politics"", ""Politics"", ""Politics"", ""Politics"", ""Politics"", ""Politics"", ""Politics"", ""Politics"", ""Politics"", ""Politics"", ""Politics"", ""Politics"", ""Politics"", ""Politics"", ""Politics"", ""Politics"", ""Politics"", ""Politics"", ""Politics"", ""Politics"", ""Politics"", ""Politics"", ""Politics"", ""Politics"", ""Politics"", ""Politics"", ""Politics"", ""Politics"", ""Politics"", ""Politics"", ""r/teenagers"", ""Politics"", ""Politics"", ""Politics"", ""Politics"", ""Politics""]";
WyldeGi;President-elect Joe Biden;PA IS BLUE!!!;"[""/r/XboxOne - The home of everything Xbox One on Reddit"", ""/r/XboxOne - The home of everything Xbox One on Reddit"", ""Politics"", ""/r/Technology "", ""/r/XboxOne - The home of everything Xbox One on Reddit"", ""The Great Hall"", ""Xbox Series X | S \u2022 News \u2022 Discussion \u2022 Community"", ""Hogwarts Legacy"", ""/r/Memes the original since 2008"", ""Minecraft on reddit"", ""Politics"", ""LoadingIcons"", ""/r/Technology "", ""TurnipExchange"", ""Anti Memes - Upvote some of the things!"", ""TurnipExchange"", ""Sea of Thieves Reddit "", ""ApexOutlands"", ""Politics"", ""fuckgravel"", ""/r/XboxOne - The home of everything Xbox One on Reddit"", ""Hogwarts Legacy"", ""Sea of Thieves Reddit "", ""Politics"", ""HauntingOfBlyManor"", ""r/AnimalCrossing"", ""/r/Memes the original since 2008"", ""ImaginarySliceOfLife: Art that showcases aspects of life in realistic or fantastical settings"", ""Salty satire and morons unite."", ""PlayStation 5 - News \u2022 Discussion \u2022 Community"", ""ApexOutlands"", ""The Great Hall"", ""/r/XboxOne - The home of everything Xbox One on Reddit"", ""Art"", ""Fantastic Beasts"", ""r/AnimalCrossing"", ""fuckgravel"", ""The Great Hall"", ""Reddit Pics"", ""Hogwarts Legacy"", ""iPad & iPad Pro"", ""Hogwarts Legacy"", ""Geometry Dash!"", ""r/Nintendo: Gaming \u2022 News \u2022 Discussion \u2022 Community"", ""TurnipExchange"", ""Hogwarts Legacy"", ""r/AnimalCrossing"", ""Reddit Pics"", ""Politics"", ""Hogwarts Legacy""]";
Velvet_Llama;President-elect Joe Biden;HOW DID A MAN THAT OLD STILL HAVE SO MUCH DAMN SWAGGER???!;"[""Best of Legal Advice (BOLA) ~ Meta discussion of r/legaladvice"", ""Popcorn tastes good."", ""/r/PublicFreakout"", ""Your Account Has Been Suspended"", ""DOOM"", ""Popcorn tastes good."", ""Popcorn tastes good."", ""NFL: National Football League Discussion"", ""Popcorn tastes good."", ""Today I Learned (TIL)"", ""Popcorn tastes good."", ""Popcorn tastes good."", ""Popcorn tastes good."", ""Popcorn tastes good."", ""Popcorn tastes good."", ""Popcorn tastes good."", ""Popcorn tastes good."", ""Popcorn tastes good."", ""Popcorn tastes good."", ""Popcorn tastes good."", ""DOOM"", ""KotakuInAction: The almost-official GamerGate subreddit!"", ""Destiny 2"", ""Popcorn tastes good."", ""Popcorn tastes good."", ""Popcorn tastes good."", ""Popcorn tastes good."", ""Fallout | Reddit"", ""Popcorn tastes good."", ""Pok\u00e9mon: Gotta Catch \u2019Em All!"", ""/r/PublicFreakout"", ""Hillary Clinton - Onward Together"", ""Popcorn tastes good."", ""Popcorn tastes good."", ""Popcorn tastes good."", ""Popcorn tastes good."", ""Popcorn tastes good."", ""Popcorn tastes good."", ""Your Account Has Been Suspended"", ""/r/PublicFreakout"", ""Popcorn tastes good."", ""Popcorn tastes good."", ""/r/Music"", ""Popcorn tastes good."", ""Popcorn tastes good."", ""Popcorn tastes good."", ""Legal Advice ~ A place to get simple legal advice* "", ""Hillary Clinton - Onward Together"", ""Popcorn tastes good."", ""Gaming Circlejerk - Home of CD Projekt Red""]";
GB1266;President-elect Joe Biden;Blue penn now too!;"[""Murdered By Words"", ""Once in a blue moon..."", ""Toilet Paper USA"", ""For your Opinions that are Unpopular "", ""Toilet Paper USA"", ""Dead by Daylight"", ""bonehurtingjuice"", ""Political Compass Memes"", ""Dead by Daylight"", ""Everything & Anything You Were Too Afraid To Ask"", ""Not like the other girls"", ""Dead by Daylight"", ""Gatekeeping"", ""People who actively act like a piece of shit"", ""A sub for Historymemes"", ""cod zombies okbr map feat 30 perks packapunch all guns call of duty hazbin hotel sex jumpscare"", ""There was an attempt.."", ""Dead by Daylight"", ""make fun of memes and stuff"", ""A sub for Historymemes"", ""Once in a blue moon..."", ""Dead by Daylight"", ""godtiersuperpowers"", ""Dead by Daylight"", ""Talk shit, get hit."", ""Dead by Daylight"", ""Memes of the Star Wars Sequels"", ""Dead by Daylight"", ""cod zombies okbr map feat 30 perks packapunch all guns call of duty hazbin hotel sex jumpscare"", ""The Flash"", ""selfies of the soul"", ""I only need two buttons, Ctrl + C and Ctrl + V."", ""/r/StarWarsBattlefront"", ""Look how stupid these kids are"", ""Print Comics and Webcomics "", ""bonehurtingjuice"", ""People Who Ate The Onion"", ""Once in a blue moon..."", ""PrequelMemes - Memes of the Star Wars Prequels"", ""bonehurtingjuice"", ""Rainbow 6"", ""I only need two buttons, Ctrl + C and Ctrl + V."", ""Once in a blue moon..."", ""bonehurtingjuice"", ""Once in a blue moon..."", ""Cutting out Panels and Pretending you did all the Work"", ""Cringetopia"", ""dankmemes"", ""Top. Minds."", ""For those bantasaurus rexes who can't be contained""]";
Verniethespectacular;President-elect Joe Biden;He’s laughing in his grave. Right along with John McCain;"[""Political Discussion"", ""Political Discussion"", ""A sub for Historymemes"", ""2020 Political Hindsight - a Donald Trump lovefest"", ""Discussion of The Ezra Klein Show"", ""Discussion of The Ezra Klein Show"", ""Ask Reddit..."", ""Ask Reddit..."", ""A sub for Historymemes"", ""/r/trees - home of the ents"", ""Astronomy"", ""Discussion of The Ezra Klein Show"", ""President-elect Joe Biden"", ""Politics"", ""Political Discussion"", ""LincolnProject"", ""LincolnProject"", ""Politics"", ""Murdered By Words"", ""Politics"", ""LincolnProject"", ""Politics"", ""Political Discussion"", ""Political Discussion"", ""Geopolitics: Getting the Big Picture"", ""Ask Reddit..."", ""Politics"", ""World News"", ""Discussion of The Ezra Klein Show"", ""Memes_Of_The_Dank"", ""Politics"", ""LincolnProject"", ""Politics"", ""Politics"", "".gifs - funny, animated gifs for your viewing pleasure"", ""Politics"", ""LincolnProject"", ""/r/Memes the original since 2008"", ""Politics"", ""United States Army on Reddit"", ""/r/Memes the original since 2008"", ""/r/Memes the original since 2008"", ""A sub for Historymemes"", ""Political Discussion"", ""/r/Memes the original since 2008"", ""socialskills"", ""Bodybuilding - everybody wants to be a bodybuilder"", ""Politics"", ""Ask Reddit..."", ""r/nonononoyes""]";
MReprogle;President-elect Joe Biden;Now, day one: Pass the  John Lewis Voting Rights Advancement Act to make sure that everyone has a voting station that isn't conveniently 4 hours away from their county among other things that lead to voting discrimination.;"[""PlayStation 5 - News \u2022 Discussion \u2022 Community"", ""PlayStation 4 - News \u2022 Discussion \u2022 Community"", ""Upvoted Not Because Girl But Because It Is Very Cool"", ""PlayStation 4 - News \u2022 Discussion \u2022 Community"", ""NFL: National Football League Discussion"", ""NFL: National Football League Discussion"", ""NFL: National Football League Discussion"", ""Game of Thrones"", ""NFL: National Football League Discussion"", ""Android"", ""Stocks - Investing and trading for all"", ""PlayStation 4 - News \u2022 Discussion \u2022 Community"", ""PlayStation 4 - News \u2022 Discussion \u2022 Community"", ""NFL: National Football League Discussion"", ""PlayStation 4 - News \u2022 Discussion \u2022 Community"", ""Plex"", ""https://www.youtube.com/watch?v=SBs455jwb8w"", ""https://www.youtube.com/watch?v=SBs455jwb8w"", ""RIP Kobe Bryant | Lakers news, rumors, discussions and more"", ""PlayStation 4 - News \u2022 Discussion \u2022 Community"", ""PlayStation 4 - News \u2022 Discussion \u2022 Community"", ""PlayStation 4 - News \u2022 Discussion \u2022 Community"", ""/r/XboxOne - The home of everything Xbox One on Reddit"", ""funny"", ""PlayStation 4 - News \u2022 Discussion \u2022 Community"", ""PlayStation 4 - News \u2022 Discussion \u2022 Community"", ""NFL: National Football League Discussion"", ""NBA"", ""PlayStation 4 - News \u2022 Discussion \u2022 Community"", ""Nintendo Switch - News, Updates, & Information"", ""NFL: National Football League Discussion"", ""https://www.youtube.com/watch?v=SBs455jwb8w"", ""PlayStation 4 - News \u2022 Discussion \u2022 Community"", ""Politics"", ""PlayStation 4 - News \u2022 Discussion \u2022 Community"", ""PlayStation 4 - News \u2022 Discussion \u2022 Community"", ""Impeach_Trump"", ""https://www.youtube.com/watch?v=SBs455jwb8w"", ""RIP Kobe Bryant | Lakers news, rumors, discussions and more"", ""PlayStation 4 - News \u2022 Discussion \u2022 Community"", ""https://www.youtube.com/watch?v=SBs455jwb8w"", ""PlayStation 4 - News \u2022 Discussion \u2022 Community"", ""PlayStation Plus"", ""PlayStation 4 - News \u2022 Discussion \u2022 Community"", ""Interesting As Fuck"", ""https://www.youtube.com/watch?v=SBs455jwb8w"", ""PlayStation 4 - News \u2022 Discussion \u2022 Community"", ""Impeach_Trump"", ""PlayStation 4 - News \u2022 Discussion \u2022 Community"", ""NFL: National Football League Discussion""]";
