user;from_subreddit;comment;used_subreddits;comment_sentiment
libsuxass;Donald Trump - 45th President of the United States of America;Have to Dealers do it;['Donald Trump - 45th President of the United States of America', 'Art', 'conservatives', 'Reddit Pics'];
ourmartyr1;Donald Trump - 45th President of the United States of America;WHAT THE FUCK DO I DO WITH ALL THESE HATS NOW?!;['Donald Trump - 45th President of the United States of America', 'r/TwoXChromosomes: You are the community. You have all the power of the internet to mold it.', 'Today I Learned (TIL)', 'World News', 'All news, US and international.', 'The UFO reddit', 'funny', 'r/gaming', 'Politics'];
UCSDflunk;Donald Trump - 45th President of the United States of America;Idk whats going on, leave a like if you just want a normal America😢;['Donald Trump - 45th President of the United States of America', 'Politics', 'White People Twitter', 'Change My View (CMV)', '/r/PublicFreakout', 'Ask Reddit...'];
NotoriousNigg4;Donald Trump - 45th President of the United States of America;Bring the roulette dealers in. They know their 35 and 17 timetables.;['Donald Trump - 45th President of the United States of America', 'r/gaming', 'Idiots In Cars', 'Novel Coronavirus (COVID-19)', '/r/PublicFreakout', 'All news, US and international.', 'UFC', 'PlayStation 5 - News • Discussion • Community', 'Australia'];
UltimateKat420;Donald Trump - 45th President of the United States of America;I'm just glad both Republicans and Democrats can get behind rushing Nevada;['Donald Trump - 45th President of the United States of America', 'WHO DID THIS???', '...where jokes go to die', 'People who actively act like a piece of shit', 'Town of Salem', 'Jokes by dark people, for dark people. Mayos get out!', 'dankmemes', 'Fallout 4', 'bad caption, bad meme'];
Blueiskewl;Donald Trump - 45th President of the United States of America;"Pray Biden away!

[Republican Call for Prayer](https://blueiscoool.blogspot.com/2020/11/republican-call-for-prayer.html)";['Donald Trump - 45th President of the United States of America', 'People who actively act like a piece of shit', '.gifs - funny, animated gifs for your viewing pleasure', 'Bad Cop, No Donut! ', 'Unresolved Mysteries', '/r/PublicFreakout'];
sweetpeapumpkin;Donald Trump - 45th President of the United States of America;Honestly I'm an Independent Biden supporter and totally thought this was from Joe's sub, keep my upvote though because if there's one thing we can all agree on it is damn NV is struggling;['Donald Trump - 45th President of the United States of America', 'Am I the Asshole? ', 'Female Hair Advice', 'Makeup Addiction', 'TrollX: It’s not about the X chromosomes in your cells, it’s about the X chromosomes in your heart.', 'Eyebleach', 'Cozy Places'];
JamPantstheFif;Donald Trump - 45th President of the United States of America;We need a federal standard, enough of this silliness.;['Donald Trump - 45th President of the United States of America', 'Idiots In Cars', 'What Could Possibly Go Wrong?', 'Look how stupid these kids are', 'Pussy Pass Denied', 'Conservative', 'Tucker Carlson: The Sworn Enemy of Lying, Pomposity, Smugness & Groupthink'];
Buckjank;Donald Trump - 45th President of the United States of America;"Nevada took to long now Georgia caught up, next thing you know, Pennsylvania will be ahead of both of them. 

I mean it must take so long because 1 person is filling in Biden's name on 65000 ballots overnight";['Donald Trump - 45th President of the United States of America', 'the thicker the skin, the better the roast', 'Lightly used ', 'Ask Reddit...'];
mmoon01;Donald Trump - 45th President of the United States of America;I mean Nevada holds the betting odds for the election no?;['Donald Trump - 45th President of the United States of America', 'r/IllegalLifeProTips', 'Brazilian Jiu-Jitsu', 'Rap', 'Unethical Life Pro Tips', 'Chess: The Game of Kings', 'Reddit Poker'];
IronScorpion438;Donald Trump - 45th President of the United States of America;The reason they are taking so long is because they are having to get out the emergency democrat ballots.;['Donald Trump - 45th President of the United States of America', 'Subreddit for lovers and seekers of The Bible', 'Roller Coasters: Rides Galore!', 'Minecraft on reddit', 'Atlañta Braves'];
SequoiaBoi;Donald Trump - 45th President of the United States of America;"Biden needs to take one. Probably loaded with Cocaine and Adderal

Edit: Thanks for award";['Donald Trump - 45th President of the United States of America', 'Insane people on Quora', 'Get Disciplined!', ' ೋღ Izlam ღೋ'];
ronc1113;Donald Trump - 45th President of the United States of America;I agree with this 100%;['Donald Trump - 45th President of the United States of America', 'Everyday Carry. What essentials do you carry on a daily basis?', 'Lifehacks', 'Watches', 'r/Camping', 'Outdoors', 'Casio G-Shock', 'r/iPhone', 'eBay'];
Che4pshoT;Donald Trump - 45th President of the United States of America;Here here! I have to piss in a cup to get a job. Seems fair.;['Donald Trump - 45th President of the United States of America', 'Steven Crowder', 'Tucker Carlson: The Sworn Enemy of Lying, Pomposity, Smugness & Groupthink', 'Republican', 'President Donald Trump - Trump 2020! - Keep America Great!'];
Sschultze;Donald Trump - 45th President of the United States of America;Where is this? I wanna move there.;"['Donald Trump - 45th President of the United States of America', 'The Joe Rogan Experience', 'Ask Reddit...', 'Power Washing Porn', 'tfatk', ""'MURICA! FUCK YEAH!""]";
sniz_fondue;Donald Trump - 45th President of the United States of America;i brought this up in 12th grade and the whole class went silent.;['Donald Trump - 45th President of the United States of America', 'BlackPeopleTwitter', 'If the building could be the home to a super villain or evil corporation, it belongs here', '/r/Memes the original since 2008', '🔥 Nature Is Fucking Lit', ' Play Stupid Games Win Stupid Prizes', 'Showerthoughts', '/r/PublicFreakout', 'Slammy Whammies', 'The Joe Rogan Experience', 'People who actively act like a piece of shit'];
MiyegomboBayartsogt;Donald Trump - 45th President of the United States of America;Eliminate piss tests and taxes and welfare can fuck off.;"['Donald Trump - 45th President of the United States of America', 'Interesting As Fuck', 'Reddit Science', 'Pussy Pass Denied', 'Catastrophic Failure', '/r/videos', 'Future(s) Studies', 'r/Firearms', ""Let's hope you didn't vote for the pedo""]";
roughneck1084;Donald Trump - 45th President of the United States of America;If I refused a drug test for my job, I’d be fired on the spot. Politicians should be required to submit to random drug tests on a regular basis in general. Failure should be an impeachable offense.;['Donald Trump - 45th President of the United States of America', 'Interesting As Fuck', 'Star Wars: The Clone Wars Based Memery', 'A sub for Historymemes', 'Conservative', 'Fragile Communism', 'President Donald Trump - Trump 2020! - Keep America Great!', 'Tucker Carlson: The Sworn Enemy of Lying, Pomposity, Smugness & Groupthink'];
basedicelovekag;Donald Trump - 45th President of the United States of America;AGREE. I have to piss in a CUP just to get any job. They should to, especially since drugs fuck them up and make em unable and unwilling to work. Sick of welfare queens;['Donald Trump - 45th President of the United States of America', 'For your Opinions that are Unpopular ', 'President Donald Trump - Trump 2020! - Keep America Great!', 'Conservative'];
libsuxass;Donald Trump - 45th President of the United States of America;The idea is right. But the reality of paying for that many drug tests and dealing with the court process of the false positives etc. would be a greater cost than it is now. Just give them a flat rate. If they wanna buy an iphone, some crack and starve, that's their problem.;['Donald Trump - 45th President of the United States of America', 'Art', 'conservatives', 'Reddit Pics'];
CurtisB615;Donald Trump - 45th President of the United States of America;I have do a piss test to make sure, I do the drugs.🤣;"['Donald Trump - 45th President of the United States of America', 'jukmifgguggh', 'GSO - Greensboro, NC subreddit', ""All The Swill That's Fit To Swig!"", 'Tequila!', 'r/Camping', ""Bourbon - America's Spirit""]";
innerpeice;Donald Trump - 45th President of the United States of America;Perhaps you should have to take a urine drug test if you’re making laws that makes me take one;"['Donald Trump - 45th President of the United States of America', 'Ask Reddit...', ""People Person's Paper People"", 'For your Opinions that are Unpopular ', 'conspiracy', 'Reddit Pics', 'Future(s) Studies', 'Intermittent Fasting', 'Guaranteed to make you smile', '/r/videos']";
j3wbacca996;Donald Trump - 45th President of the United States of America;"If anything, it should be the other way around. If someone is on welfare, which is literally living off other people’s work, than they definitely shouldn’t be allowed to spend that money on drugs/alcohol/tobacco 

But honestly it isn’t hard to find a good paying job that won’t care if you just smoke weed, lmao.";['Donald Trump - 45th President of the United States of America', 'StupIDPol: Marxist critique of essentialism', 'Fragile Communism', 'RetroFuturism: For the fantastic, delusional dreams of our past.', 'Red Dead Redemption Mysteries and Easter Eggs', 'Crews Crew', 'Shuffles Deck', 'Collapse of Civilization'];
legend_kda;Donald Trump - 45th President of the United States of America;I support this. I’d be fine with tax money helping the needy, but not people who will turn around to spend the money on drugs.;"['Donald Trump - 45th President of the United States of America', 'Unethical Life Pro Tips', ""Explain Like I'm Five | Don't Panic!"", 'r/IllegalLifeProTips', 'Star Wars - A long time ago, in a galaxy far, far, away...', 'TrueOffMyChest, a place for people who need to speak their mind', 'TalesFromRetail', ' Play Stupid Games Win Stupid Prizes', 'White People Twitter', 'All news, US and international.']";
IslandJack76;Donald Trump - 45th President of the United States of America;Ain’t nothing like going to Walmart (or like) the 1st or 3rd weekend and seeing your tax $$ cutting in front of you even though you only have 15-20 items, ....like what’s your rush, ain’t like you gonna be late for work.;['Donald Trump - 45th President of the United States of America', 'Red Dead Redemption 2', 'Reddit Pics', 'Watch People Die Inside', 'Red Dead Fashion', 'reggae'];
SuperCalzor;Donald Trump - 45th President of the United States of America;"The Post Office just did away with drug testing because the turnover rate is too high and we don't have enough applicants.

The new hires are absolutely retar.... Rhymes with guitarded.";"['Donald Trump - 45th President of the United States of America', 'Conservative', ""Pokémon GO's Largest Grassroots Network: The Silph Road"", 'Pokémon GO - Discover Pokémon in the Real World!', 'Watch Reddit Die', 'President Donald Trump - Trump 2020! - Keep America Great!', 'WoW: Classic', 'VeChain']";
TrumpsSleeveBitch;Donald Trump - 45th President of the United States of America;Why do you have to pass a urine test to get a job?;"['Donald Trump - 45th President of the United States of America', 'Politics', 'Conservative', '', ""It's Mueller Time!""]";
NuncioX;Donald Trump - 45th President of the United States of America;Goddamnit... you people need to read. Everywhere they've tried this they've found that less than 3% of welfare recipients tested positive for anything, at the cost of millions of tax payer money for these tests. You'd rather demonize the poor than look at the assholes in office who only serve to divide us.;['Donald Trump - 45th President of the United States of America', 'The Tin Foil Hat Podcast', 'unclebens', 'Faith No More', 'A place to discuss anything related to shrooms'];
Tilt23Degrees;Donald Trump - 45th President of the United States of America;Considering I used to have to piss in a cup to work at a fucking credit union, yea you fucking should.;['Donald Trump - 45th President of the United States of America', 'Ask Reddit...', '/r/worldpolitics', 'Reddit Pics', 'atheism', 'funny', 'WTF?!', 'Advice Animals'];
tallpintplease;Donald Trump - 45th President of the United States of America;I love this so true;['Donald Trump - 45th President of the United States of America', 'The darkest recesses of humanity', 'Ask Reddit...', 'Frugal Living: Waste Less-Gain More!'];
Creative_Ambassador;Donald Trump - 45th President of the United States of America;You know things must be bad when the Amish come out to vote.;['Donald Trump - 45th President of the United States of America', 'r/TeslaMotors - Your Tesla Community on Reddit', 'Conservative', '/r/Memes the original since 2008', 'SocialJusticeInAction'];
Lepurkaun;Donald Trump - 45th President of the United States of America;Everybody gangster on Election Day until the Amish show up.;['Donald Trump - 45th President of the United States of America', 'Political Compass Memes', 'Conservative', '/r/Memes the original since 2008'];
BigChungusDisease;Donald Trump - 45th President of the United States of America;They really do be living in an Amish paradise;['Donald Trump - 45th President of the United States of America', 'Call of Duty: Modern Warfare | Reddit', 'Political Compass Memes', 'Le Drumpf is Finished!', 'Conservative'];
cockerspaniel12;Donald Trump - 45th President of the United States of America;That is awesome! Is this PA or OH?;['Donald Trump - 45th President of the United States of America', 'The place to snark on crazy fundies', 'r/BelowDeck', 'DuggarsSnark Subreddit'];
zartdeus;Donald Trump - 45th President of the United States of America;Love this 😍;['Donald Trump - 45th President of the United States of America', 'Selling Sunset', '/r/conspiracytheories', 'Relationship Advice', 'analytical, conceptual and objective', 'conspiracy', 'Female Dating Strategy '];
RUIN_NATION_;Donald Trump - 45th President of the United States of America;Is this in PA?;['Donald Trump - 45th President of the United States of America', '/r/guns: Firearms and related articles', 'Cyberpunk 2077', 'Bitcoin - The Currency of the Internet', 'Denver Broncos Discussion', 'World News', 'Reddit Dreams: Everything about dreams', 'The DCTV Universe', 'The Flash'];
haywardjablome3680;Donald Trump - 45th President of the United States of America;This makes me smile. Gotta love the Amish. There are Amish settlements a bit north of me. When I take the bus they sometimes go across the country with the most of the  settlement. They are so nice. I have great respect for the Amish.;"['Donald Trump - 45th President of the United States of America', 'Gun Politics', 'All posts must be related to gun politics; civil discussion is expected', 'SocialJusticeInAction', '/r/Memes the original since 2008', 'Conservative', 'President Donald Trump - Trump 2020! - Keep America Great!']";
K80_Stein;Donald Trump - 45th President of the United States of America;This is AWESOME!!!!!!!;['Donald Trump - 45th President of the United States of America', 'Personal Finance', 'Curly Hair', 'Disney Magic Kingdoms mobile game ', 'Ask Reddit...', 'Throne of glass stuff'];
Eaglescout801;Donald Trump - 45th President of the United States of America;Must be a windyt day of those buggies are going 30...;['Donald Trump - 45th President of the United States of America', 'Just Rolled Into the Shop', 'Look how stupid these kids are', 'For your things that have been through hell and back. ', 'Hold my juice box!'];
hfxcon;Donald Trump - 45th President of the United States of America;I wonder if the left will call this trump train terrorists;['Donald Trump - 45th President of the United States of America', 'Conservative', 'Free Speech', 'For your Opinions that are Unpopular ', 'VoluntaristMemes', 'Halifax', 'Canada'];
MrUnderhill1296;Donald Trump - 45th President of the United States of America;I just spit my lunch everywhere! I’m laughing so hard!!;['Donald Trump - 45th President of the United States of America', 'the Wilderness Survival subreddit'];
SUPERI0RGLITCH;Donald Trump - 45th President of the United States of America;Aren’t amish not allowed to be involved in politics?;['Donald Trump - 45th President of the United States of America', 'make fun of memes and stuff', 'Aliens', 'PhotoshopBattles', 'Conservative', 'i am goinna c cum', 'average people on an average website', 'Reddit Pics'];
SouthernDudeYT;Donald Trump - 45th President of the United States of America;Was this in PA?;['Donald Trump - 45th President of the United States of America', 'Ask Reddit...', 'r/DadJokes - the best Dad Jokes on reddit', 'r/teenagers', 'BitLife', 'Hostile Architecture', 'ProLife', 'Geometry Dash!'];
Klarick;Donald Trump - 45th President of the United States of America;TIL Amish vote.  For some reason I always thought they removed themselves from such worldly things.;"['Donald Trump - 45th President of the United States of America', 'Ask Reddit...', 'r/gaming', 'Today I Learned (TIL)', 'White People Twitter', ""OldSchoolCool: History's cool kids, looking fantastic "", 'funny', 'All news, US and international.', 'So many books, so little time', 'Conservative']";
TheKittensAreComing;Donald Trump - 45th President of the United States of America;This brought a big smile to my face.  I bet a Biden bus would find a way to victimize themselves if they got stuck behind it in 'traffic' just like they did when their OWN staff in the white SUV tried to ram a Trump truck OFF the road!!!;['Donald Trump - 45th President of the United States of America', 'DiWHY', 'CrappyOffBrands', 'Conservative', 'Sex', 'Advice Animals', 'Interesting As Fuck', 'Cats'];
happytrumpday;Donald Trump - 45th President of the United States of America;"[https://youtu.be/NJZwpQ-St\_w](https://youtu.be/NJZwpQ-St_w)  
Trump Victory Video";['Donald Trump - 45th President of the United States of America'];
totally-not-kevduit;Donald Trump - 45th President of the United States of America;Amish are scary did you know the Amish mafia is in the top five most powerful on earth;['Donald Trump - 45th President of the United States of America', 'Hey, wtf happened to the offensive jokes link?', 'President Donald Trump - Trump 2020! - Keep America Great!'];
anytownusa11;Donald Trump - 45th President of the United States of America;With the way things are moving long term, we're all going to have to choose between being a communist and being Amish.;['Donald Trump - 45th President of the United States of America', 'Conservative', 'Watch Reddit Die', 'r/SpaceX, the premier SpaceX discussion community', 'Norway', 'A subreddit for followers of Jesus Christ.'];
Demonangeldust;Donald Trump - 45th President of the United States of America;Honestly, I’m just excited for this whole thing to be over with, the stress of having to vote and all, it’s rough, man.;"['Donald Trump - 45th President of the United States of America', ""Noah's Ark"", 'r/AnimalCrossing', 'NoahGetTheDeathStar']";
AzrealNibbs12;Donald Trump - 45th President of the United States of America;Lol I forgot this happened. Didn’t they try to remove it or something?;['Donald Trump - 45th President of the United States of America', 'Terraria', '/r/Memes the original since 2008', 'ARK: Survival Evolved', 'Cursed Comments', 'Conservative'];
sherminator18163;Donald Trump - 45th President of the United States of America;"Don't go left, there's a creepy Uncle there.

Always stay right.";"['Donald Trump - 45th President of the United States of America', 'For your Opinions that are Unpopular ', '/r/Memes the original since 2008', ""For those bantasaurus rexes who can't be contained"", 'Bleach Anime and Manga', 'World News']";
hairyspaniel;Donald Trump - 45th President of the United States of America;"It is funny how so many people loved Trump before he ran for president. Then all of a sudden the man becomes public enemy number one.

There is some serious brain washing going on on the left. Trump is a great man and has exceeded my expectations as president in a lot of different ways.  I'm excited for 4 more years!";"['Donald Trump - 45th President of the United States of America', 'Twin Peaks', 'Ask Reddit...', 'Minnesota Twins', ""No Man's Sky | Reddit""]";
HealzYT;Donald Trump - 45th President of the United States of America;Haha i love this man <3;['Donald Trump - 45th President of the United States of America', 'WoW: Classic'];
PKC_Man;Donald Trump - 45th President of the United States of America;One of the few that were very helpful to Kevin, along with the bird lady.;['Donald Trump - 45th President of the United States of America', 'Conservative', 'Your premier source for Can-Con'];
Undead_Unicornn;Donald Trump - 45th President of the United States of America;Yes sir!! 💪🇺🇸 MAGA 2020;['Donald Trump - 45th President of the United States of America', 'A sub for Historymemes', 'identify unknown objects', 'bluelivesmatters', 'For Professional Chefs who are also Redditors', 'President Donald Trump - Trump 2020! - Keep America Great!', 'Apple Watch Faces'];
ironhead_87;Donald Trump - 45th President of the United States of America;Good thing trump helped him and it wasnt biden or this would have been a shorter movie;['Donald Trump - 45th President of the United States of America', 'SandersForPresident'];
little_b1198;Donald Trump - 45th President of the United States of America;"I'm scared to mention this. I don't want my favorite classic to get re-vised. But

 in die hard 2 a black women tells the police chief thats him or I'm pregnant with trumps baby. 
And in die hard 3 with Samuels Jackson mclain was being told about how the whites allways put blacks down and mclain responded no I don't your racist. Rember mclain is white. You and everyone you know will never ever see a movie like those ever again if liberals win. Don't let this happen and don't silence speach.";['Donald Trump - 45th President of the United States of America', 'Subnautica: Descend into the Depths', '/r/PublicFreakout'];
He-Rah;Donald Trump - 45th President of the United States of America;Biden would've tried getting Kevin into a closet;['Donald Trump - 45th President of the United States of America', 'WTF?!', 'Petty Revenge', 'TalesFromRetail', 'Today I Learned (TIL)', 'Watch People Die Inside', '/r/PublicFreakout', 'Happy embarrassed girls bring great joy to everybody!', 'Rick and Morty News and Discussion'];
MGhostly106;Donald Trump - 45th President of the United States of America;Or when he was in Little Rascals;"['Donald Trump - 45th President of the United States of America', ""The straw that broke the camel's back. In post form."", 'TYLER, THE CREATOR', 'Minecraft on reddit', 'Confess your secrets', 'TRAVIS SCOTT', 'Kanye West', 'Lil Uzi Vert', 'Lightly used ']";
jkjk3232;Donald Trump - 45th President of the United States of America;K I’m a liberal dude but this is funny, look at us laughing together friends!;"['Donald Trump - 45th President of the United States of America', 'For your Opinions that are Unpopular ', 'Lose money with friends!', ""Explain Like I'm Five | Don't Panic!"", 'The Twin Cities - the front page of Minneapolis and St. Paul', 'InfrastructurePorn: Because sometimes faster is better.', 'Minneapolis, Minnesota - the front page of Minneapolis', 'jukmifgguggh', '35,000+ Tweets, No Self Awareness', 'the beautiful impossibilities that we want to live in']";
HelloIamIronMan;Donald Trump - 45th President of the United States of America;"Kevin: Is at Home, Alone.

Biden: *sniffs* It’s free real estate";"['Donald Trump - 45th President of the United States of America', 'The Boys', '/r/Memes the original since 2008', 'Who Would Win?', 'comicbooks', 'r/teenagers', 'Terrible Fandom Memes', ""Men's Rights :: Advocating for the social and legal equality of men and boys since 2008""]";
felinemooddisorder;Donald Trump - 45th President of the United States of America;Love it;['Donald Trump - 45th President of the United States of America', 'Watch People Die Inside', 'A subreddit for cute and cuddly pictures', 'Well... That sucks...', 'For photos that are, you know, mildly interesting', 'Idiots In Cars', 'What Could Possibly Go Wrong?', 'oddlyterrifying'];
ravioli_king;Donald Trump - 45th President of the United States of America;Something else Reddit would love to be on the front page... yet it doesn't seem to be on the front page.;['Donald Trump - 45th President of the United States of America', 'SocialJusticeInAction', 'gamedev - game development, programming, design, writing, math, art, jams, postmortems, marketing', 'Star Trek - News and Discussion', 'Gaming Circlejerk - Home of CD Projekt Red'];
UknightedKingdumb;Donald Trump - 45th President of the United States of America;One of the very few things Trump says that I agree with.;['Donald Trump - 45th President of the United States of America', 'Ask Reddit...', 'Kaiserreich: Legacy of the Weltkrieg', 'Vexillology: for all you flag lovers out there!', 'Leftist Vexillology', 'For alternate history, historical, and whatif conjecture!'];
MountainAdditional73;Donald Trump - 45th President of the United States of America;I love this scene lmao;['Donald Trump - 45th President of the United States of America', 'Fishing ', 'reddit for mountain bikers'];
bigbubbuzbrew;Donald Trump - 45th President of the United States of America;Oldie but goodie.;['Donald Trump - 45th President of the United States of America', 'All news, US and international.', 'World News', 'President Donald Trump - Trump 2020! - Keep America Great!'];
zac3446;Donald Trump - 45th President of the United States of America;USA USA USA;['Donald Trump - 45th President of the United States of America', 'Lost Pause', 'NEKOPARA! Cats Paradise ', 'Tea, Candy, and Music!', 'goodanimememes'];
