user;from_subreddit;comment;used_subreddits;comment_sentiment
tossedsalad8;Donald Trump - 45th President of the United States of America;Well said;['Donald Trump - 45th President of the United States of America', 'Golf Clash'];
OneForgottenMeme;Donald Trump - 45th President of the United States of America;"At a young kid, and one who supports our president, it’s hard to defend my beliefs because if I do, I’m a racist and a homophobic, it’s very depressing because I’m none of those things.
I’m glad you wrote this post OP, it lifted my spirits.";['Donald Trump - 45th President of the United States of America', 'Interesting As Fuck', 'Ask Reddit...', 'Just your everyday occurrence in Russia', 'The friendlier part of Reddit.', 'Wow Fuck the What', 'Well... That sucks...', 'Shitty Superpowers', 'DOOM'];
PurpleOwl85;Donald Trump - 45th President of the United States of America;"Much appreciated✅

I was really annoyed yesterday when I saw at least 5 different article/memes about Trump on the escalator at West Point.

Also the fact that anyone notices how he drinks water proves how ridiculously strange and powerful social media has become.

*Let the man do his job and be grateful he hasn't given up* 🌈";['Donald Trump - 45th President of the United States of America', 'BoJack Horseman', 'A subreddit for cute and cuddly pictures', 'The friendlier part of Reddit.', 'The Sopranos', 'For your Opinions that are Unpopular ', 'HistoryPorn: Exploring the past through historical photographs.', 'Oy with the Poodles', 'Teen Mom Reddit is More Classier'];
cmb9221;Donald Trump - 45th President of the United States of America;"Sometimes I wonder if I’m the insane one, not being brainwashed by all the biased, reckless media... but I’m not succumbing to the fake news. I do think the silent masses will speak and vote.

Edit to add: Trump trolls, feel free to stay in the 99.9% other areas of reddit to satisfy your leftist confirmation bias. It’s waaay cozier in that bubble, just where they want you.";['Donald Trump - 45th President of the United States of America', 'Relationships', 'r/IllegalLifeProTips', 'Things you wish you could say to them.', 'Personal Finance', 'Relationship Advice', 'Beauty', 'Today I Fucked Up'];
SloppySutter;Donald Trump - 45th President of the United States of America;What I have found is that all my friends that are on the left have full-out convinced themselves that the reason they don’t have what other people have is because “the system is rigged against them”. It blows my mind why people can’t look at an orphan like Steve Jobs or a billionaire like Bill Gates (who came from nothing), and make the observation that those men PROSPERED in our society of capitalism and low regulation! Perhaps it’s a lack of parenting, or perhaps a lack of interest in logical reasoning, but these people honestly believe that by having the government regulate absolutely everything that they’ll be “more free” and have more money and things at their disposal?! I just find that ludicrous. The government is terrible at everything they try to orchestrate. As soon as they touch something, it gets over-staffed, starves for an endless supply of tax money, and becomes mindlessly bureaucratic. Is that what they want in their hospitals? In their workplaces? I have to believe this is all a lack of education on how government works in schools. I really think half these people don’t understand that Congress makes laws... not the president! I’m with all of you folks. Stay level-headed and show up to vote in November!;['Donald Trump - 45th President of the United States of America', 'Fitness', 'Tucker Carlson: The Sworn Enemy of Lying, Pomposity, Smugness & Groupthink', '/r/guns: Firearms and related articles', 'Chemical Engineering', 'Skateboarding', '/r/dubstep - The Home of Dubstep on Reddit', 'Skookum', 'The Ultimate Dubstep Artist'];
SFPmodsAreFascists;Donald Trump - 45th President of the United States of America;"I support Bernie, but the Cultural Revolution nonsense has gone too far.

#TRUMP2020";['Donald Trump - 45th President of the United States of America', 'AskThe_Donald', 'SandersForPresident'];
NYnicegirl;Donald Trump - 45th President of the United States of America;Here after hearing so many platforms supporting our president were removed! What the actual f**k? Since when does freedom of speech only apply to the left? They turned me who was indifferent toward politics into a surefire vote for Trump2020!;"['Donald Trump - 45th President of the United States of America', 'Sims4', ""Home of Netflix's Queer Eye: More than a Makeover"", 'All things Bravo & Real Housewives!', 'Top Chef ', 'MTV’s Double Shot at Love with DJ Pauly D and Vinny', 'Polycystic Ovarian Syndrome']";
camarang;Donald Trump - 45th President of the United States of America;WE TRUMPED 'EM IN '16, AND WE'LL TRUMP 'EM IN '20!!;['Donald Trump - 45th President of the United States of America', 'AskOuija: Get your answers one letter at a time', 'dankmemes', 'iDubbbzTV', 'An ode to Ken M. ', '/r/h3h3productions - official subreddit of h3h3productions - h3h3', 'r/teenagers', 'PrequelMemes - Memes of the Star Wars Prequels', 'Spongebob Memes', 'im14andthisisdeep'];
bobbyb8484;Donald Trump - 45th President of the United States of America;Love our President!!!;"['Donald Trump - 45th President of the United States of America', 'Netflix', 'Personal Finance', ""AMC's Mad Men"", 'Star Trek - News and Discussion', 'Novel Coronavirus (COVID-19)', ""OldSchoolCool: History's cool kids, looking fantastic "", 'Absolutely, Wildly, Unapologetically, SHAMELESS']";
MVPROMO;Donald Trump - 45th President of the United States of America;We all have to stick together!;"['Donald Trump - 45th President of the United States of America', 'For your Opinions that are Unpopular ', 'United States Marine Corps', 'TrueUnpopularOpinion', 'r/IllegalLifeProTips', ""Because you're drunk -- and so am I."", 'Classic lines from other posts']";
beepbabboop;Donald Trump - 45th President of the United States of America;"Remember that the truth is stronger than the lie 
That pride of ones country is a good and a very common thing in non western countries 
That it's better to be alone than to be in bad company better to be single but yourself than in a relationship and living a lie 

I envy the USA and its president for he may not be perfect but he is proud to be a American and that is enough for me";['Donald Trump - 45th President of the United States of America', 'funny', '/r/Memes the original since 2008', 'Best of Bumble', 'A subreddit for cute and cuddly pictures'];
treug0lnik;Donald Trump - 45th President of the United States of America;I'm actually not from United States but I like what Trump does for US. It's really sad that there are so many people who hate Trump because of the what? Because of their politician illiteracy.;"['Donald Trump - 45th President of the United States of America', 'President Donald Trump - Trump 2020! - Keep America Great!', ""Vulkan – Khronos' API for High-efficiency Graphics and Compute on GPUs"", 'i3 Window Manager', 'Ask Reddit...', 'ThatsInsane', '/r/Memes the original since 2008', 'Math Jokes']";
ScientificSlothx;Donald Trump - 45th President of the United States of America;Lets just hope this subreddit doesn’t get taken down too;['Donald Trump - 45th President of the United States of America', 'Ask Reddit...', '/r/Memes the original since 2008', 'Nostalgia', 'Admit your wrongdoings. ', 'Because choices matter.', 'Showerthoughts'];
billyrubin1;Donald Trump - 45th President of the United States of America;I'm tired of the American left tearing down our memorials and spitting on our heritage.;['Donald Trump - 45th President of the United States of America', 'NSFW_GIF', 'The Intellectual Dark Web', 'President Donald Trump - Trump 2020! - Keep America Great!', 'Opiates ', 'Orgasm control', 'Marriage'];
PopularElevator2;Donald Trump - 45th President of the United States of America;Georgia and NC as well.;['Donald Trump - 45th President of the United States of America', 'Ask Reddit...', 'CS Career Questions', 'Conservative', 'Experienced Devs'];
Caravan-Gaming;Donald Trump - 45th President of the United States of America;Lmao for real;['Donald Trump - 45th President of the United States of America', 'For photos that are, you know, mildly interesting', 'The Elder Scrolls V: Skyrim', 'Showerthoughts', '/r/stopdrinking: a support group in your pocket!', 'Everything Science', 'Coin Collecting - Coin News - Coins in History '];
Kydocks;Donald Trump - 45th President of the United States of America;IF I SEE 86% FROM NEVADA OR ARIZONA I AM GOING TO FLIP;['Donald Trump - 45th President of the United States of America', '/r/PewdiepieSubmissions', 'Genesis', 'A FLOWER?'];
Marlin3360;Donald Trump - 45th President of the United States of America;Have an upvote from a Dem. lol;['Donald Trump - 45th President of the United States of America', '2020 Political Hindsight - a Donald Trump lovefest', 'Reddit Pics', 'BNAA - Before And After Pictures Of Adopted Animals', 'OurPresident', '/r/PublicFreakout', '.gifs - funny, animated gifs for your viewing pleasure', 'Biden_OnTheRecord', 'Republican Values', 'Democrats: Unite for a Better Future'];
cajun1420;Donald Trump - 45th President of the United States of America;Stevie wonder was supervising the counting of the votes;['Donald Trump - 45th President of the United States of America', 'Relationships'];
FridayswPewds;Donald Trump - 45th President of the United States of America;You already know he thrown out at least 12 Trump ballots and handed at least 20 people the sharpie.;"['Donald Trump - 45th President of the United States of America', ""People Person's Paper People"", 'youngpeopleyoutube', 'r/ProtectandServe', ""The Left Can't Meme"", 'foundfelix', 'Conservative', 'Steven Crowder']";
reddit-is-bunk;Donald Trump - 45th President of the United States of America;Forgot the Biden/Harris mask;['Donald Trump - 45th President of the United States of America', 'We all need to vent sometimes', 'President Donald Trump - Trump 2020! - Keep America Great!', 'conservatives', 'Republican', 'ConservativesOnly -- If you are a conservative... welcome! '];
OilRepresentative738;Donald Trump - 45th President of the United States of America;Pennsylvania, too.;['Donald Trump - 45th President of the United States of America', 'EnoughCommieSpam', '/r/Memes the original since 2008', 'We all need to vent sometimes', 'dankmemes', 'TumblrInAction: O Toucan, Where Art Thou?', 'We are all going to die', 'Le Drumpf is Finished!'];
Nixonplumber;Donald Trump - 45th President of the United States of America;Why is no one sounding major alarms in Nevada? No poll watchers or Republican poll watchers can watch any of the counts like they can in every other state?;['Donald Trump - 45th President of the United States of America', 'I saw a car. I took a picture of it.', 'Tits <3', 'Corvette'];
bumbletowne;Donald Trump - 45th President of the United States of America;Isn't a lot of military absentee ballots? Nevada was the hub of moving stuff across the country which is why Las Vegas even exists.;['Donald Trump - 45th President of the United States of America', 'Ask Reddit...', 'funny', 'All news, US and international.', 'A subreddit for cute and cuddly pictures', 'r/gaming', '.gifs - funny, animated gifs for your viewing pleasure', 'World of Warcraft', 'Humans just being bros'];
slicknick2940;Donald Trump - 45th President of the United States of America;Honestly at this point I’m expecting Biden but praying for trump.;"['Donald Trump - 45th President of the United States of America', ""'MURICA! FUCK YEAH!"", 'Z Nation', 'Fake History Porn ', 'DayZ Xbox', 'Ask Reddit...', 'r/nonononoyes', 'Call of Duty: Modern Warfare | Reddit', 'Starterpacks', 'Car Memes']";
MasterTrovan;Donald Trump - 45th President of the United States of America;I'm not american. Can someone tell me pls if Trump already lost or if there's still a chance?;['Donald Trump - 45th President of the United States of America', 'Kingkiller Chronicle', 'Play and Create Pokémon Hacks', 'suctiondildos', 'World of Warcraft', 'WoW: Classic', 'Porn Attack'];
Gormanz16;Donald Trump - 45th President of the United States of America;They’re not updating til tm morning;['Donald Trump - 45th President of the United States of America'];
Nuff_Nuff_Jigglypuff;Donald Trump - 45th President of the United States of America;Can anyone explain what is happening in those states? What’s the hold up?;['Donald Trump - 45th President of the United States of America', 'ActualPublicFreakouts', 'Conservative', 'Mostly cringe-y images of Nice Guys™', 'conspiracy'];
AntiuppGamingYT;Donald Trump - 45th President of the United States of America;Def true;['Donald Trump - 45th President of the United States of America', '/r/Memes the original since 2008', 'Destiny 2', 'For your Opinions that are Unpopular '];
cajun1420;Donald Trump - 45th President of the United States of America;Sure they did 😉;['Donald Trump - 45th President of the United States of America', 'Relationships'];
420snailmode;Donald Trump - 45th President of the United States of America;💀💀 truth;['Donald Trump - 45th President of the United States of America', 'Female Dating Strategy '];
fourstringsofgroove;Donald Trump - 45th President of the United States of America;Well according to google's stats, if this sloth counts any faster Biden gonna win. They got him @ 264 with nevada in his pocket with 6 votes. Sounds fishy.;['Donald Trump - 45th President of the United States of America', '/r/worldpolitics', 'funny', 'Reddit Pics', 'A gallery of inexplicable stupidity', 'WalkAway'];
jimbobeezee;Donald Trump - 45th President of the United States of America;There's a lawsuit for Wisconsin because at 1 am a random 100k votes all for Biden came in, very sketchy;['Donald Trump - 45th President of the United States of America', 'Bloons TD 6', 'Christianity', '/r/PhasmophobiaGame', 'KSI', 'Virtual Reality Gaming', 'YouTubers - A place for the YouTube Community', 'Monterey Bay'];
NotBurrito;Donald Trump - 45th President of the United States of America;This was actually pretty hilarious;['Donald Trump - 45th President of the United States of America', 'JustBootThings', 'Factorio ', 'Le Drumpf is Finished!', 'Your Account Has Been Suspended', 'United States Air Force Reddit', 'Conservative'];
HillbillySwank;Donald Trump - 45th President of the United States of America;What it feels like at this point haha;['Donald Trump - 45th President of the United States of America', 'Ask Reddit...', 'Today I Learned (TIL)', 'Today I Fucked Up'];
Stage3GuildNavigat0r;Donald Trump - 45th President of the United States of America;It should have been Trump vs Sanders.;['Donald Trump - 45th President of the United States of America', 'Darknet', 'Alberta: East of the Rockies and West of the rest. ', 'Insane People on Facebook', 'satanism', 'DoorDash Community', 'Personal Finance For Canadians', 'Your premier source for Can-Con', 'Stories from in and about Edmonton'];
EGoldenGod;Donald Trump - 45th President of the United States of America;I’m a snowflake but I loved this. Prime memes transcend politics;"['Donald Trump - 45th President of the United States of America', 'Everything about Tinder', 'RIP Kobe Bryant | Lakers news, rumors, discussions and more', ""America's Pastime"", '2020 WS Champion Los Angeles Dodgers', '/r/moviescirclejerk', 'dankmemes']";
Padri23andrew;Donald Trump - 45th President of the United States of America;Being honest I prefer Sanders than Biden I mean that man is a socialist (and I hate them with all my heart)  but at least he can say two coherent sentences without pooping in his pants;['Donald Trump - 45th President of the United States of America', 'A sub for Historymemes', 'PrequelMemes - Memes of the Star Wars Prequels', 'selfies of the soul', '/r/Memes the original since 2008', 'Fragile Communism', 'GayPorn'];
Qu1nn1fer;Donald Trump - 45th President of the United States of America;Honestly if bernie can get past security and the body guards to smack trump up with a chair he deserves to be president;"['Donald Trump - 45th President of the United States of America', 'Ask Reddit...', 'Terraria', 'MadeMeSmile', ""JoJo's Bizarre Shitposts"", 'How do you do, fellow kids?', 'Starterpacks', 'woof_irl: for the pupper in u', '/r/Memes the original since 2008', 'ElsaGate']";
shrek_crusader;Donald Trump - 45th President of the United States of America;[https://www.youtube.com/watch?v=ZEDP5-O9MZI](https://www.youtube.com/watch?v=ZEDP5-O9MZI) Don't worry, Trump can take him down;['Donald Trump - 45th President of the United States of America', 'dankmemes', 'A sub for Historymemes', '/r/PewdiepieSubmissions', 'Minecraft on reddit', 'cod zombies okbr map feat 30 perks packapunch all guns call of duty hazbin hotel sex jumpscare'];
Bedrix96;Donald Trump - 45th President of the United States of America;"Biden/Trump : *Wins & is really tired* 

Sanders : *Rushes in with a referee & money in the bank case*";['Donald Trump - 45th President of the United States of America', 'Map Porn, for interesting maps', 'Two-Sentence Horror Stories: Bite-sized scares. ', 'Reddit Pics', 'Cool Guides', ' ೋღ Izlam ღೋ', '😎EPIC STYLE😎'];
abicus4343;Donald Trump - 45th President of the United States of America;All hail president Kamala!!!! The US is fucked.;"['Donald Trump - 45th President of the United States of America', 'Ask Reddit...', 'Sadly, this is not the Onion.', 'Welcome to /r/Food on Reddit!', 'A subreddit for cute and cuddly pictures', ""OldSchoolCool: History's cool kids, looking fantastic ""]";
RawrEcksDeekys;Donald Trump - 45th President of the United States of America;I'm a Democrat and this actually pretty funny;['Donald Trump - 45th President of the United States of America', 'Fortnite: Battle Royale', 'selfies of the soul', 'Am I the Asshole? ', 'Popping Cysts and Pimples', 'Super Smash Bros.'];
Maxi110703;Donald Trump - 45th President of the United States of America;Trump2020🇺🇸❤️;['Donald Trump - 45th President of the United States of America', '/r/PublicFreakout', 'Seattle', 'Road Bikes', 'All things Puck'];
UFA_in_Training;Donald Trump - 45th President of the United States of America;Should be the 'China in the Bank' briefcase;"['Donald Trump - 45th President of the United States of America', 'Contagious Laughter', 'Are you seeing this shit?', 'Reddit Science', 'There was an attempt..', ""Damn, that's interesting!"", 'NFL: National Football League Discussion', ""The Internet's Tailgate"", 'r/SquaredCircle']";
theDankusMemeus;Donald Trump - 45th President of the United States of America;Ok guys this is how Bernie can still win!;"['Donald Trump - 45th President of the United States of America', 'Fake History Porn ', '/r/Memes the original since 2008', 'Hearts of Iron', 'DankLeft', 'Conservative', 'White People Twitter', 'Kaiserreich: Legacy of the Weltkrieg', 'We all need to vent sometimes', 'PresidentialRaceMemes', ""The Left Can't Meme""]";
allwinss;Donald Trump - 45th President of the United States of America;Oh my Gawd! - JR;['Donald Trump - 45th President of the United States of America', 'I Took a Picture: Give and get feedback on photography', 'AppleHelp', 'AirPods', 'r/MLS: The central hub for all levels of soccer in the US & Canada, especially Major League Soccer', 'Apple Music', 'iOSBeta', 'Lovecraft Country', 'Atlanta United FC', 'r/iPhone', 'The Glock subreddit'];
ZeroPointGravity;Donald Trump - 45th President of the United States of America;bah gawd!;"['Donald Trump - 45th President of the United States of America', 'Item Shop', 'P5R - Persona 5 - ペルソナ5 ザ・ロイヤル', 'Blursed Images', ""Let's hope you didn't vote for the pedo"", 'yesyesyesyesno', 'Animemes', '/r/Memes the original since 2008']";
MurderFloof;Donald Trump - 45th President of the United States of America;The right CAN meme? The left is quaking at this new development.;"['Donald Trump - 45th President of the United States of America', 'Ask Reddit...', 'selfies of the soul', '/r/PewdiepieSubmissions', ""Accidental Racism: When innocent things appear to be racism, though it's totally not intentional "", 'A subreddit for cute and cuddly pictures', 'President Donald Trump - Trump 2020! - Keep America Great!', 'Startled Cats', 'eef freef!', '[distant cromching noises]', 'Osana']";
jessie_g93;Donald Trump - 45th President of the United States of America;Classic 😂 if only real life was this comedic;['Donald Trump - 45th President of the United States of America', '/r/Memes the original since 2008', 'Everything about Tinder', '2B2H', 'the thicker the skin, the better the roast', 'A subreddit for cute and cuddly pictures', 'Ask Reddit...'];
Daniel_USA;Donald Trump - 45th President of the United States of America;no one was expecting that heel turn;"['Donald Trump - 45th President of the United States of America', ""What's everyone on about?"", 'r/SquaredCircle', 'Showerthoughts', 'Reddit Pics', 'Today I Fucked Up', 'Samurai Jack']";
TheTrashman1597;Donald Trump - 45th President of the United States of America;Funny af;['Donald Trump - 45th President of the United States of America', 'All things Trashy!', 'Rainbow 6', '/r/weed: The catch-all subreddit for all things weed.', '/r/trees - home of the ents', 'conspiracy'];
Gavin_av;Donald Trump - 45th President of the United States of America;Let’s see how long it is until this gets removed...;['Donald Trump - 45th President of the United States of America', 'Give me my Diamondback', 'Ask Me Anything'];
CptSpecTacuIar;Donald Trump - 45th President of the United States of America;I wonder how long it will take for reddit to take this down again all while keeping the exact trump copy up?;['Donald Trump - 45th President of the United States of America', 'Idiots In Cars', 'Uplifting News', 'All things Trashy!', 'Dashcam', 'Ask Reddit...', 'Gifs That Keep On Giving', 'bullybackfire', 'Cool Guides', 'All news, US and international.', 'Maybe a true hot mess?'];
ArseDeep;Donald Trump - 45th President of the United States of America;Chinese Virus;['Donald Trump - 45th President of the United States of America', 'Richmond, VA', 'nosleep', 'the Wilderness Survival subreddit', '.gifs - funny, animated gifs for your viewing pleasure', 'Ask Reddit...', 'Conservative', 'Whatever keeps your boat up (or down).', ' The Arsenal on Reddit | Victoria Concordia Crescit'];
essaysmith;Donald Trump - 45th President of the United States of America;This will be removed by the Chinese Reddit overlords soon.;['Donald Trump - 45th President of the United States of America', 'r/TwoXChromosomes: You are the community. You have all the power of the internet to mold it.', 'funny', 'Sadly, this is not the Onion.', 'Ask Reddit...', 'The Anti-Fascists of reddit', 'All things Trashy!', 'World News', 'Future(s) Studies', 'Today I Learned (TIL)'];
PM_YOUR_SIDE_CLUNGE;Donald Trump - 45th President of the United States of America;"CHI

NA";"['Donald Trump - 45th President of the United States of America', 'Look how stupid these kids are', ""IT'S TIME TO STOP"", 'British Problems', 'KotakuInAction: The almost-official GamerGate subreddit!', 'Fallout | Reddit', 'CasualUK']";
oregon300;Donald Trump - 45th President of the United States of America;cun flu shis;"['Donald Trump - 45th President of the United States of America', 'All news, US and international.', 'WTF?!', 'World News', ""OldSchoolCool: History's cool kids, looking fantastic "", ""What's The Word: For When You Can't Think of the Word You Need""]";
ThePonzo;Donald Trump - 45th President of the United States of America;Im glad he did not infect Trump [when he met him at the White House](https://i.redd.it/p1or6somlhv31.gif) last year.;['Donald Trump - 45th President of the United States of America', 'All news, US and international.', 'Reddit Pics', 'WTF?!', 'Game of Thrones', 'For Everything TotalBiscuit', '/r/cringepics: when it hurts just to look'];
DrJester;Donald Trump - 45th President of the United States of America;"1. Pooh Virus
2. Kung Flu
3. Pooh Flu
4. Bat Soup Flu
5. Wuhan Flu
6. Wuhan Virus
7. Rice Virus
8. Bootlegged Mexican Beer Virus
9. Commie Virus
10. Commie Flu
11. ChineREEEse Virus
12. ChineREEEse Flu
13. Bat Flu
14. Bat Virus
15. Winnie the Flu
16. Xi Jinbing. (Bing(病) is the Chinese word for virus.)
17. Commie Cough
18. Black Pepper Death
19. Chopsick
20. Srirachoo 
21. Terracougha Army 
22. Great Whoop of China
23. Lung Pao Sicken
24. Ching Chang Chong Virus
25. China Cough
26. China Suffocation
27. China Flu
28. Rice Dick Virus
29. Ching Chong Chills
30. Commie Cough
31. Coof
32. Rice Wheezer


EDIT: added more suggestions!

&nbsp;

EDIT2: Another suggestion! Thanks everyone! hahaha

EDIT3: Another suggestion!";['Donald Trump - 45th President of the United States of America', 'KotakuInAction: The almost-official GamerGate subreddit!', 'Shuffles Deck', 'Hoggit Fighter Wing', 'President Donald Trump - Trump 2020! - Keep America Great!'];
jay070771;Donald Trump - 45th President of the United States of America;Kung Pao cold;['Donald Trump - 45th President of the United States of America', 'Reddit Pics'];
DannysBeard1977MAGA;Donald Trump - 45th President of the United States of America;HE IS DISGUSTING!!!!LOOKS LIKE ATROLL;['Donald Trump - 45th President of the United States of America', 'Ask Reddit...', 'President Donald Trump - Trump 2020! - Keep America Great!'];
NewPlankton;Donald Trump - 45th President of the United States of America;CHINA WUHAN VIRUS ORCHESTRATED BY CCP. Also you guys and gals should know in 2018 a chinese biologist was caught smuggling Sars and Mers;['Donald Trump - 45th President of the United States of America'];
